Card Service,IMG,Card Type,Visa or Mastercard,Mastercard,Visa,Master Card,Custody,Card Issuance Fee,Annual Fee,APR/Investing/Vault,Cashback,Mobile Pay,KYC,Regions KYC Available,Countries Available,FX Fee,Top-up Methods,Sign-up Bonus,ATM Withdrawal Limit,Daily Spending Limit,IBAN/SWIFT/SEPA,Pros,Cons,Marketing Description,Ref ?,,,,Main Page Cashback,H1,Meta_title,Meta_description
THORWallet Card,https://lh3.googleusercontent.com/d/1K_waVdvbIyR0t2MSZMG0GRVAnBurogTm,Virtual only,Mastercard Debit,Mastercard,,Standard,Self-custody,Free,Standard Free; Gold $49/month; Platinum $199/month,No,Planned: TITN staking will provide USDC cashback (launching Q3 2025),Yes (Apple Pay; Google Pay; Samsung Pay),Yes,100+ countries; Standard tier available in most countries (monthly $100k limit),"Afghanistan, Albania, Åland Islands, Andorra, Anguilla, Antigua & Barbuda, Argentina, Armenia, Aruba, Australia, Austria, Azerbaijan, Bahamas, Bahrain, Bangladesh, Barbados, Belgium, Belize, Benin, Bermuda, Bosnia and Herzegovina, Botswana, Brazil, Brunei, Bulgaria, Burundi, Cambodia, Canada, Cayman Islands, Central African Republic, Chad, Chile, China, Colombia, Costa Rica, Croatia, Cyprus, Czechia, Denmark, Dominica, Dominican Republic, Estonia, Faroe Islands, Finland, France, Georgia, Germany, Greece, Hong Kong, Hungary, Iceland, India, Indonesia, Ireland, Italy, Japan, Latvia, Liechtenstein, Lithuania, Luxembourg, Malaysia, Mexico, Netherlands, New Zealand, North Macedonia, Norway, Peru, Poland, Portugal, Réunion, Romania, San Marino, Singapore, Slovakia, Slovenia, South Korea, Spain, Svalbard & Jan Mayen, Sweden, Switzerland, Taiwan, Thailand, Turkey, United Kingdom, Uruguay",0.25-1% crypto conversion + standard Mastercard FX rates,"USDC, USDT, ETH (Arbitrum network)",None,Expected based on tier,"Standard: $100k/month, $50k/day; Gold: $500k/month, $200k/day; Platinum: $2M/month, $200k/day",Yes (Swiss IBAN; multi-currency CHF/EUR/USD/CNY),Swiss IBAN multi-currency account; exceptional limits (up to $2M monthly); self-custody until conversion; bank transfer limits up to $10M/month,No cashback yet (Q3 2025); manual conversion required before spending; Arbitrum only for crypto; 0.25-1% conversion fee,"THORWallet Card powered by Fiat24 brings Swiss banking infrastructure to the THORChain ecosystem with a virtual Mastercard supporting exceptional $2 million monthly spending limits on Platinum tier. Maintain true self-custody of USDC, USDT, and ETH on Arbitrum network in your THORWallet until manually converting to fiat (CHF, EUR, USD, CNY) for spending at any Mastercard merchant globally. With Swiss IBAN multi-currency accounts, bank transfer limits reaching $10 million monthly, and planned TITN token staking cashback launching Q3 2025, THORWallet Card bridges DeFi-native THORChain users with regulated Swiss banking. Perfect for high-volume traders and THORChain believers across 100+ countries seeking self-custody combined with institutional-grade spending capacity, though note manual conversion and Arbitrum-only support may limit convenience compared to instant-conversion competitors.",TRUE,До 5% комиссии от свапов реферала в TGT токенах; требуется THORName для создания ссылки,До 5% комиссии от свапов реферала в TGT токенах; требуется THORName для создания ссылки,До 5% комиссии от свапов реферала в TGT токенах; требуется THORName для создания ссылки,None,Review THORWallet Card,THORWallet Card Review 2026: Self-Custody & 100+ Countries,"THORWallet Card — 0.25-1% fee, available in 100+ countries. Read our 2026 review!"
TokenPocket Card,https://lh3.googleusercontent.com/d/17duo_gHZ4-GFWuj0xXVtHWDD1keNLGY_,Virtual (physical for Premium coming),Visa + Mastercard Debit,"Visa, Mastercard",Standard,Standard,Self-custody,NFT minting fee (subsidized by TokenPocket),Free,No,None,Yes (Apple Pay; Google Pay; PayPal; Samsung Pay; Alipay; WeChat Pay),Yes (via Fiat24; Swiss FINMA licensed),100+ countries globally (Swiss bank-backed),"Australia, Canada, Faroe Islands, Hong Kong",1% crypto top-up fee + standard network FX,"USDC on Arbitrum; future support for USDT, BTC, ETH, BNB, TRX, PEPE and more networks",First 500 users with 10+ USDC top-up receive ARB airdrop,Physical card for Premium users only,Based on account balance,Yes (Swiss IBAN via Fiat24; multi-currency USD/EUR/CHF/CNH),Swiss FINMA-licensed via Fiat24; NFT-based account ownership; WeChat Pay and Alipay integration; decentralized card management on Arbitrum,1% top-up fee; Arbitrum/USDC only currently (expanding); requires NFT minting; Premium physical card not yet available,"TokenPocket Card (TP Card) pioneered blockchain-based banking in September 2024 with Swiss FINMA-licensed accounts managed through NFT smart contracts on Arbitrum. Mint a bank account NFT through TokenPocket wallet to receive decentralized control over your Swiss-backed Visa and Mastercard debit cards supporting USD, EUR, CHF, and CNH. With on-chain balance tracking via EUR24/USD24/CHF24 tokens mirroring your card funds, TP Card offers transparent blockchain verification of every transaction while maintaining Swiss banking compliance. Supporting Apple Pay, Google Pay, PayPal, Samsung Pay, WeChat Pay, and Alipay for seamless spending at 100 million merchants worldwide, TP Card bridges Web3 self-custody with Web2 payment infrastructure—perfect for TokenPocket's global user base seeking compliant banking without sacrificing decentralized principles.",TRUE,Процент от top-up fee реферала (зависит от VIP уровня); 1000 points за реферала; минимум 100 USDC топ-ап,Процент от top-up fee реферала (зависит от VIP уровня); 1000 points за реферала; минимум 100 USDC топ-ап,Процент от top-up fee реферала (зависит от VIP уровня); 1000 points за реферала; минимум 100 USDC топ-ап,,,,Information not found
Trade Republic Card,https://lh3.googleusercontent.com/d/1-TZxQzOdFeifBKpDAxCqK1Bn74AVvCXf,Physical (virtual coming),Visa Debit,Visa,Standard,,Custodial,Free,Free,Yes: 4% APY on clearing account balance (rates variable),Saveback: 1% on eligible purchases if depositing additional €50/month,Yes (Apple Pay; Google Pay),Yes,Germany and EU primarily,,0% foreign exchange fees,EUR deposits; must buy crypto on platform (cannot deposit from external wallets),None,€1500/day; over €100 withdrawals have €1 fee waived,Based on account balance,Yes (German IBAN bank account),0% FX fees; 4% interest on account balance; 0.7% crypto-to-fiat conversion (lowest tier); 54 crypto + stocks/ETFs investment options,Cannot deposit external crypto (must buy on platform); 1% cashback requires €50 monthly investment; Germany/EU focused; not pure crypto card,"Trade Republic Card transforms Germany's leading investment platform into everyday spending power with a free Visa debit card earning 4% APY on account balances plus optional 1% Saveback cashback. Supporting 54 cryptocurrencies alongside stocks and ETFs, Trade Republic offers exceptionally low 0.7% crypto-to-fiat conversion costs—among Europe's cheapest alongside WhiteBIT and Holyheld. With zero foreign exchange fees, €1,500 daily ATM withdrawals, German IBAN bank account in your name, and seamless Apple Pay/Google Pay integration, Trade Republic bridges investment and payments. However, users cannot deposit external crypto—you must buy through Trade Republic's platform first—and Saveback requires €50 monthly additional investment. Perfect for German and European investors seeking all-in-one investment and payment solution with exceptional conversion rates, though limited to platform-purchased crypto restricts wallet flexibility.",TRUE,€15 каждому после первого трейда реферала,€15 каждому после первого трейда реферала,€15 каждому после первого трейда реферала,1%,Review Trade Republic Card,Trade Republic Card Review 2026: 1% Cashback & Free ATMs,"Trade Republic Card — 1% cashback, 4% APY. 0% FX fees, available in Germany & EU. Read our 2026 review!"
Tria Card,https://lh3.googleusercontent.com/d/1PYhE-yb9kKoP204Cxzy4eBAC2B--QyAE,Virtual + Physical (coming),Visa Debit,Visa,Signature,,Self-custody,Free,Free,Yes: Earn up to 12% yield on USD deposits,None,Yes (Apple Pay; Google Pay),Yes,100+ countries globally,"Afghanistan, Albania, Algeria, Andorra, Angola, Antigua and Barbuda, Argentina, Armenia, Australia, Austria, Azerbaijan, Bahamas, Bahrain, Bangladesh, Barbados, Belgium, Belize, Benin, Bhutan, Bolivia, Bosnia and Herzegovina, Botswana, Brazil, Brunei, Bulgaria, Burkina Faso, Burundi, Cambodia, Cameroon, Canada, Cape Verde, Central African Republic, Chad, Chile, Colombia, Comoros, Congo, Costa Rica, Croatia, Czechia, Democratic Republic of the Congo, Denmark, Djibouti, Dominica, Dominican Republic, Ecuador, Egypt, El Salvador, Equatorial Guinea, Eritrea, Estonia, Eswatini, Ethiopia, Fiji, Finland, France, Gabon, Gambia, Georgia, Germany, Ghana, Greece, Grenada, Guatemala, Guinea, Guinea-Bissau, Guyana, Haiti, Honduras, Hungary, Iceland, Indonesia, Jamaica, Japan, Jordan, Kazakhstan, Kenya, Kiribati, Kosovo, Kuwait, Kyrgyzstan, Laos, Latvia, Lebanon, Lesotho, Liberia, Libya, Liechtenstein, Lithuania, Luxembourg, Madagascar, Malawi, Malaysia, Maldives, Mali, Malta, Marshall Islands, Mauritania, Mauritius, Mexico, Micronesia, Moldova, Monaco, Mongolia, Montenegro, Morocco, Mozambique, Namibia, Nauru, Netherlands, New Zealand, Nicaragua, Niger, Nigeria, North Macedonia, Norway, Oman, Pakistan, Palau, Panama, Papua New Guinea, Paraguay, Peru, Philippines, Poland, Portugal, Qatar, Romania, Rwanda, Saint Kitts and Nevis, Saint Lucia, Saint Vincent and the Grenadines, Samoa, San Marino, Saudi Arabia, Senegal, Serbia, Seychelles, Sierra Leone, Singapore, Slovakia, Slovenia, Solomon Islands, Somalia, South Africa, South Korea, South Sudan, Spain, Sri Lanka, Suriname, Sweden, Switzerland, Taiwan, Tajikistan, Tanzania, Thailand, Timor-Leste, Togo, Tonga, Trinidad and Tobago, Tunisia, Turkmenistan, Tuvalu, Uganda, United Arab Emirates, United Kingdom, United States, Uruguay, Uzbekistan, Vanuatu, Vatican City, Yemen, Zambia, Zimbabwe",Not disclosed; competitive rates advertised,"BTC, USDC and other major cryptocurrencies from any self-custody wallet",None,Expected with physical card,Based on wallet balance and verification,Yes (multi-currency account USD/EUR/GBP),First to support Bitcoin self-custody top-ups; Account Abstraction for smooth UX; 12% yield on deposits; true non-custodial spending,Physical card coming soon; limited crypto variety currently; yield rates variable; Smart Account adds complexity,"Tria Card made history in December 2025 as the first truly non-custodial global neobank enabling self-custodied Bitcoin top-ups directly from hardware wallets, mobile wallets, multisig, or any Bitcoin wallet you control. Built on Smart Account technology with Account Abstraction for gasless transactions and seamless user experience, Tria never takes possession of your Bitcoin—sign and send directly through non-custodial smart contracts when loading the card. Earn up to 12% annual yield on USD deposits while maintaining instant spending power via Visa at 100+ countries globally, with multi-currency accounts supporting USD, EUR, and GBP. Perfect for Bitcoin maximalists and self-custody advocates seeking institutional yields without sacrificing control, Tria delivers revolutionary non-custodial infrastructure with premium banking features including Apple Pay, Google Pay, and upcoming physical cards.",TRUE,20% от стоимости карты + XP за активацию и первую покупку; до 40% ambassador commission,20% от стоимости карты + XP за активацию и первую покупку; до 40% ambassador commission,20% от стоимости карты + XP за активацию и первую покупку; до 40% ambassador commission,Up to 6%,Review Tria Card,Tria Card Review 2026: Self-Custody & 150+ Countries,"Tria Card — Up to 6% cashback, yield up to 16% USD / 7% BTC. 0% FX fee, available in 100+ countries globally. Read our 2026 review!"
Trustee Card,https://lh3.googleusercontent.com/d/1pqb59g_wxdEDXmXSAWh8rzCIX19PtJm4,Virtual + Physical,Mastercard Debit,Mastercard,,Standard,Custodial,Not disclosed,Free,No,None,Yes (Apple Pay; Google Pay; Samsung Pay),Yes,Global (specific countries not disclosed),"Austria, Belgium, Bulgaria, Croatia, Cyprus, Czechia, Denmark, Estonia, Finland, France, Germany, Greece, Hungary, Iceland, Ireland, Italy, Latvia, Liechtenstein, Lithuania, Luxembourg, Malta, Netherlands, Norway, Poland, Portugal, Romania, Slovakia, Slovenia, Spain, Sweden",Standard Mastercard FX rates,"USDT, BTC, ETH, TRX and 30+ cryptocurrencies; supports TRC20, ERC20, SOL, NEAR",None,Available with physical card,Based on account balance,No,30+ crypto support across multiple networks; instant crypto-to-EUR conversion; multi-level 2FA and biometric security,Fully custodial; no cashback program; limited public information on fees and limits; conversion rates not transparent,"Trustee Plus Card transforms the popular Trustee crypto wallet into real-world spending power with instant cryptocurrency-to-euro conversion at point of sale. Supporting 30+ coins across TRC20, ERC20, SOL, and NEAR networks including USDT, BTC, ETH, and TRX, Trustee Plus combines wallet functionality with payment infrastructure—buy crypto with Visa/Mastercard, exchange between all cryptocurrencies at lightning speed, and spend anywhere Mastercard is accepted globally. With multi-level two-factor authentication, biometric Face ID access, and decentralized security protocols, Trustee Plus prioritizes safety alongside convenience. Integrated with Apple Pay, Google Pay, and Samsung Pay for contactless payments, Trustee Plus delivers straightforward crypto spending for users seeking all-in-one wallet-exchange-card solution, though custodial model and limited transparency on fees may concern privacy-focused users.",TRUE,До 45% от комиссий Trustee Plus от транзакций реферала + €5 за выпуск карты,До 45% от комиссий Trustee Plus от транзакций реферала + €5 за выпуск карты,До 45% от комиссий Trustee Plus от транзакций реферала + €5 за выпуск карты,,,,Information not found
Tuyo Card,https://lh3.googleusercontent.com/d/1JnGoKCOJZ46qljjc3BmclTPDD3GZFUk7,Virtual (physical coming),Visa Debit,Visa,Standard,,Self-custody,Free,Free,Yes: DeFi Vaults up to 11% APY on USDC/EURC/BTC/ETH,TUYO rewards tokens (seasonal multipliers; TGE early 2026),Yes (Apple Pay; Google Pay),Yes,"US, Spain, select EU and Latin America countries","Antigua and Barbuda, Argentina, Austria, Bahamas, Barbados, Belgium, Belize, Bermuda, Bolivia, Brazil, British Virgin Islands, Canada, Cayman Islands, Chile, Colombia, Costa Rica, Czechia, Denmark, Estonia, Finland, France, Germany, Greece, Hungary, Ireland, Italy, Latvia, Lithuania, Luxembourg, Malta, Mexico, Netherlands, Poland, Portugal, Romania, Slovakia, Slovenia, Spain, Sweden, United Kingdom, United States",Standard Visa rates,USDC on Base network; automatic fiat-to-USDC conversion (USD/EUR/MXN) at no fee,None,Not available (virtual only; no PIN/ATM access),Up to $50000+/day based on verification,Yes (multi-currency IBANs: USD/EUR/MXN via Bridge Ventures),True self-custody with private keys on-device; 11% APY DeFi yields; automatic salary conversion to USDC; Base network integration,No ATM/PIN access; USDC on Base only; physical card coming soon; no traditional cashback yet (TUYO token TGE pending),"Tuyo Card revolutionizes self-custodial banking with true private key ownership where your keys never leave your device while spending USDC on Base at any Visa merchant globally. Receive salaries directly in multi-currency IBANs (USD, EUR, MXN) with automatic zero-fee conversion to USDC, then earn up to 11% APY on holdings through integrated DeFi Vaults—all without surrendering custody to banks or exchanges. With instant virtual card deployment via Apple Pay and Google Pay, flexible spending limits up to $50,000+ daily, and upcoming TUYO rewards token generation in early 2026, Tuyo bridges self-custody principles with real-world utility. Perfect for crypto-native users in US, Spain, and Latin America seeking internet-native banking without intermediaries or custodial risk.",TRUE,До 50% от TUYO rewards реферала + 25% от Tier-2 рефералов (indirect),До 50% от TUYO rewards реферала + 25% от Tier-2 рефералов (indirect),До 50% от TUYO rewards реферала + 25% от Tier-2 рефералов (indirect),Crypto rewards,Review Tuyo Card,Tuyo Card Review 2026: Crypto Rewards & Low FX,"Tuyo Card — Crypto rewards, earn up to 11% APY. Standard Visa rates, available in US, Spain, select EU/LatAm. Read our 2026 review!"
UltimoPay Card,https://lh3.googleusercontent.com/d/1kOJerW8Bb97xhSYYW4jMm8B_QD1gH7Ph,Virtual + Physical,Visa + UnionPay Platinum,Visa,Platinum,,Custodial,Varies (application and account opening fees),Not disclosed,No,None,Expected support,Yes,Global (offshore banking model),,"0.75% merchant and ATM transaction fee (advertised as ""low"")","USDT, BTC (load to USD offshore account)",None,$20000/day (may vary by country),No stated spending limits,Yes (offshore bank account linked to card),No spending limits; high $20k daily ATM withdrawal; offshore banking structure; UnionPay and Visa options; lowest exchange fees advertised,Offshore model may raise compliance concerns; application fees required; fully custodial; limited public transparency on costs,"UltimoPay Card delivers unrestricted crypto spending through an offshore banking structure offering both Visa Platinum and UnionPay cards with no spending limits and exceptional $20,000 daily ATM withdrawal capacity. Exchange USDT or BTC to USD through the UltimoPay Wallet, load funds to your personal offshore bank account, and spend globally at 40+ million Visa merchants with advertised 0.75% transaction fees. With no load limits, no hidden fees, and the lowest exchange rates claimed in the industry, UltimoPay targets high-volume users seeking borderless financial freedom beyond traditional banking restrictions. Perfect for international businesses and digital nomads requiring substantial liquidity and minimal geographic constraints, though offshore structure and limited transparency may concern compliance-focused users.",TRUE,До $50 USDT за реферала при выполнении условий,До $50 USDT за реферала при выполнении условий,До $50 USDT за реферала при выполнении условий,None,Review UltimoPay Card,UltimoPay Card Review 2026: Offshore & Low 0.75% Fees,"UltimoPay Card — 0.75% fee, available in Global. Read our 2026 review!"
Uphold Card,https://lh3.googleusercontent.com/d/1TQ4_AWA2FMJBGAZ8XqNDYpVodIm6p6hi,Virtual + Physical,Visa (US) / Mastercard (UK),"Visa, Mastercard",Standard,Standard,Custodial,Free,Free,No,Up to 6% XRP promotional (then 2-4% ongoing); no staking required,Yes (Apple Pay; Google Pay),Yes,USA and UK only,,Premium tiers: 0% foreign transaction fees,"250+ assets: cryptocurrencies, precious metals (gold, silver), fiat currencies",None,Available at Visa/Mastercard ATMs,Based on verification,No,"250+ asset support (crypto, metals, fiat); up to 6% XRP cashback with no staking; zero foreign transaction fees (premium tiers)",US/UK only; promotional 6% cashback temporary; merchant exclusions reduce rewards; fully custodial,"Uphold Card transforms 250+ assets into everyday spending power with unmatched versatility—spend from Bitcoin, Ethereum, gold, silver, or any of 250+ cryptocurrencies and fiat currencies with real-time conversion at checkout. Earn up to 6% promotional cashback in XRP (then 2-4% ongoing) with zero staking requirements, plus enjoy zero foreign transaction fees on premium tiers for global travelers. Available as Visa in the US and Mastercard in the UK, Uphold seamlessly integrates with your multi-asset portfolio allowing instant switching between crypto, precious metals, and fiat at point of sale. Perfect for US and UK residents seeking maximum asset flexibility and substantial no-stake rewards, though geographic limitations and temporary promotional rates may disappoint international users seeking permanent high cashback.",TRUE,$20 BTC каждому после трейда $250+ рефералом + $20 BTC каждому за активацию карты + 3 транзакции по $10+,$20 BTC каждому после трейда $250+ рефералом + $20 BTC каждому за активацию карты + 3 транзакции по $10+,$20 BTC каждому после трейда $250+ рефералом + $20 BTC каждому за активацию карты + 3 транзакции по $10+,Up to 6%,Review Uphold Card,Uphold Card Review 2026: Up to 6% Cashback & 0% FX USA/UK,"Uphold Card — Up to 6% cashback. Premium tiers: 0% FX fees, available in USA & UK. Read our 2026 review!"
UR Card,https://lh3.googleusercontent.com/d/15FxtVH5RtAxUrlewcWnj5Z8wObYO1Om4,Virtual only,Mastercard Debit,Mastercard,,Standard,Hybrid custody,Basic Free; Pro $24/month,Basic Free; Pro $24/month,No,None,Yes (Apple Pay; Google Pay; Samsung Pay),Yes,"45+ countries (Europe, Asia, Oceania, select Americas/Africa); US excluded",,Pro: 0% crypto off-ramp fee (promotional); Basic: standard fees apply,"ETH, USDC, USDT, USDe across Arbitrum, Base, Ethereum, Mantle networks",None,Not available (virtual only),€70000 fixed monthly limit (all tiers),No (but offers tokenized UR Cash balance on Mantle),Swiss FINMA-regulated; instant crypto conversion and spending; Pro tier 0% off-ramp fees; multi-network support,Virtual only (no ATM); no deposit insurance; US excluded; fixed €70k monthly cap; funds convert to custodial fiat after deposit,"UR Card brings Swiss regulatory oversight to virtual crypto spending with FINMA-supervised infrastructure enabling instant on-chain deposits across Arbitrum, Base, Ethereum, and Mantle networks. Users maintain self-custody until depositing crypto, which immediately converts to fiat and is represented as tokenized UR Cash on Mantle blockchain under platform control—a hybrid model balancing security and convenience. The Pro tier ($24/month) unlocks 0% crypto off-ramp fees during promotions, same-day bank payouts, and priority support, while Basic offers free entry with standard conversion costs. Perfect for European and Asian crypto users seeking regulated virtual spending with multi-network flexibility, though US exclusion, virtual-only format preventing ATM access, and fixed €70,000 monthly limits may restrict high-volume or cash-dependent users.",TRUE,$5 каждому после KYC + первой траты $5+; unlimited рефералы,$5 каждому после KYC + первой траты $5+; unlimited рефералы,$5 каждому после KYC + первой траты $5+; unlimited рефералы,None,Review UR Card,UR Card Review 2026: 45+ Countries & Hybrid Custody,"UR Card — Pro: 0% crypto off-ramp (promo); Basic: std fees, 45+ countries (Europe/Asia/Oceania/selected Americas/Africa; no US). Read our 2026 review!"
Utorg Card,https://lh3.googleusercontent.com/d/1JY-pdZN4LciBYZDWjF1lwFCYl0eGOvex,Virtual only,Visa + Mastercard Prepaid,"Visa, Mastercard",Standard,Standard,Self-custody,Free,Free,No,None,Yes (Apple Pay; Google Pay),Yes,EEA residents only (excludes UK/US),"Austria, Belgium, Bulgaria, Croatia, Cyprus, Czechia, Denmark, Estonia, Finland, France, Germany, Greece, Hungary, Iceland, Ireland, Italy, Latvia, Liechtenstein, Lithuania, Luxembourg, Malta, Netherlands, Norway, Poland, Portugal, Romania, Slovakia, Slovenia, Spain, Sweden, Ukraine",~0.5% crypto-to-EUR conversion + gas fees,200+ cryptocurrencies across 12 blockchains,None,Not available (virtual only),€50000/month,No,Non-custodial with private key control; 200+ crypto support; €50k monthly limit; zero EUR transaction fees; PCI DSS Level 2 security,EEA only; virtual only (no ATM); must pre-convert crypto to EUR; no cashback; no deposit insurance,"Utorg Card pioneers non-custodial spending in the European Economic Area with users retaining complete control of private keys while converting 200+ cryptocurrencies across 12 blockchains to EUR for instant Visa and Mastercard spending. Supporting major networks including Ethereum, BSC, Polygon, Arbitrum, and Solana, Utorg enables seamless Apple Pay and Google Pay integration with €50,000 monthly spending limits and zero fees on EUR transactions. With PCI DSS Level 2 security certification, 3D Secure protection, and Binance Pay integration for easy top-ups, Utorg delivers institutional-grade security without sacrificing self-custody principles. Perfect for EEA residents prioritizing control over convenience, though virtual-only format, mandatory pre-conversion to EUR, and lack of rewards program may limit appeal compared to full-service competitors offering physical cards and cashback incentives.",FALSE,Не найдено публичной реферальной программы,Не найдено публичной реферальной программы,Не найдено публичной реферальной программы,None,Review Utorg Card,Utorg Card Review 2026: Zero Fees & EEA 0% FX,"Utorg Card — ~0.5% + gas fees, available in EEA. Read our 2026 review!"
