Card Service,IMG,Card Type,Visa or Mastercard,Mastercard,Visa,Master Card,Custody,Card Issuance Fee,Annual Fee,APR/Investing/Vault,Cashback,Mobile Pay,KYC,Regions KYC Available,Countries Available,FX Fee,Top-up Methods,Sign-up Bonus,ATM Withdrawal Limit,Daily Spending Limit,IBAN/SWIFT/SEPA,Pros,Cons,Marketing Description,Ref ?,,,,Main Page Cashback,H1,Meta_title,Meta_description
Gemini Credit Card,https://lh3.googleusercontent.com/d/1Q4NWuco7qO-r06-x-NN-AjujnsfKsK7l,Virtual + Physical (multiple designs),Mastercard Credit,Mastercard,,Standard,Custodial,Free,Free,Yes: Gemini Earn products with variable APY,Up to 4% crypto back (4% on dining/groceries up to $300/month spend; then 1%),Yes (Apple Pay; Google Pay),Yes,USA only,,Up to 2.49% crypto conversion + standard Mastercard FX rates,Link to Gemini account; spend in fiat (USD),Referral: $50 per friend + $250 bonus per 5 referrals (up to $5000/year),Available at Mastercard ATMs,Based on creditworthiness,No,Up to 4% crypto rewards in BTC or 50+ cryptos; 10% back at select merchants; $50 referral bonuses; premium card designs,US only; requires credit check; 2.49% crypto purchase fee if buying crypto; rewards capped at $300/month for 4% rate,"Gemini Credit Card elevates your spending with up to 4% back in Bitcoin, Ethereum, Solana, XRP, or any of 50+ cryptocurrencies on Gemini—instantly deposited with every purchase. Earn 4% on dining, groceries, and streaming services for your first $300 monthly spend, then 1% on everything else, plus 10% back at partner merchants like Chipotle and Southwest Airlines. Choose from stunning card designs including Bitcoin, Solana, and XRP editions, all with zero annual fees. Perfect for Americans who want to invest as they spend while building a diversified crypto portfolio through everyday purchases.",TRUE,$50 криптой каждому; бонус $250 за 5-го реферала (макс 50 рефералов/год),$50 криптой каждому; бонус $250 за 5-го реферала (макс 50 рефералов/год),$50 криптой каждому; бонус $250 за 5-го реферала (макс 50 рефералов/год),Up to 4%,Review Gemini Credit Card,Gemini Credit Card Review 2026: 4% Crypto Back & No Fees,"Gemini Credit Card — Up to 4% crypto back. Variable APY via Gemini Earn. Up to 2.49% conv fee, USA only. Read our 2026 review!"
Gnosis Pay Card,https://lh3.googleusercontent.com/d/1cjqMexhaaFDp9_X3zxbEfe0LgVr4XehR,Physical only (virtual coming March 2025),Visa Debit,Visa,Standard,,Self-custody,€30.23 (often waived via referrals),Free,No,Up to 5% in GNO tokens (0.1-100+ GNO holdings + OG NFT bonus),Yes (Google Pay; Apple Pay April 2025),Yes,"32 European countries including UK, EEA, Switzerland","Argentina, Austria, Belgium, Brazil, Bulgaria, Colombia, Croatia, Cyprus",0% FX fees (Visa standard rates with no markup),"EURe, GBPe stablecoins on Gnosis Chain",€10 bonus after €50 spend with referral,€200/month or 5 withdrawals free; then 2% + €1 minimum,€8000/day,Yes (EU cardholders only; certain nationalities),World's first self-custodial Visa card; zero transaction/FX/gas fees; up to 5% GNO cashback; includes IBAN,Europe/UK only; stablecoins only (EURe/GBPe); no car rentals or automated fuel pumps; bridging to Gnosis Chain required,"Gnosis Pay Card is the world's first truly self-custodial Visa debit card, allowing you to spend EURe and GBPe stablecoins directly from your Gnosis Safe wallet while maintaining complete control of your private keys. Earn up to 5% cashback in GNO tokens with weekly automatic rewards, enjoy zero transaction fees, zero FX markups, and seamless Visa acceptance at 80+ million merchants globally. With integrated IBAN accounts for EU users and partnership with regulated e-money institution Monerium, Gnosis Pay delivers DeFi principles with TradFi convenience—perfect for European crypto natives who refuse to compromise on self-custody.",TRUE,40 EURe/GBPe рефереру + 10 EURe/GBPe рефералу после трат 50+ (для OG NFT),40 EURe/GBPe рефереру + 10 EURe/GBPe рефералу после трат 50+ (для OG NFT),40 EURe/GBPe рефереру + 10 EURe/GBPe рефералу после трат 50+ (для OG NFT),Up to 5%,Review Gnosis Pay Card,Gnosis Pay Card Review 2026: 5% Cashback & 0% FX[1][2][4][7],"Gnosis Pay Card — Up to 5% cashback. 0% FX, available in 32 EU countries incl. UK, EEA, CH. Read our 2026 review!"
Holyheld Card,https://lh3.googleusercontent.com/d/1iDwfpX_94H7HrWSG_JTe80GM9WRmzkqQ,Virtual + Physical (3 tiers),Mastercard Prepaid,Mastercard,,Standard,Hybrid custody,Classic €29; Limited €99; Metal €199,Free (one-time card fee only),No,0.5-1% USDC cashback (no staking required),Yes (Apple Pay; Google Pay),Yes,30 EEA countries only,"Austria, Belgium, Bulgaria, Croatia, Cyprus, Czechia, Denmark, Estonia, Finland, France, Germany, Greece, Hungary, Iceland, Ireland, Italy, Latvia, Liechtenstein, Lithuania, Luxembourg, Malta, Norway, Poland, Portugal, Romania, Slovakia, Slovenia, Spain, Sweden, The Netherlands",0% within EEA; 2.5% + €1 outside EEA,1200+ cryptocurrencies across 14+ blockchains; manual conversion to EUR required,None,Available with physical card,€10000/day,Yes (European IBAN with SEPA transfers),Non-custodial until conversion; 1200+ crypto support across 14 chains; 1% USDC cashback with no staking; IBAN integration,EEA only; 2.5% + €1 fee outside EEA; manual pre-loading required; hybrid custody model,"Holyheld Card brings non-custodial freedom to European crypto spending with support for 1,200+ cryptocurrencies across 14+ blockchains including Ethereum, Polygon, Arbitrum, and Solana. Choose from three card tiers—Classic plastic (€29), Limited Edition (€99), or premium Metal (€199)—all earning 0.5-1% USDC cashback with zero staking requirements. With a European IBAN for SEPA transfers and instant conversion through the BRRR protocol, Holyheld lets you maintain control of your crypto until you're ready to spend, bridging DeFi flexibility with Mastercard's global acceptance across 30 EEA countries.",TRUE,Оба получают rewards после регистрации по реферальной ссылке,Оба получают rewards после регистрации по реферальной ссылке,Оба получают rewards после регистрации по реферальной ссылке,Up to 1%,Review Holyheld Card,Holyheld Card Review 2026: 1% Cashback & 30 EEA,"Holyheld Card — Up to 1% cashback. 0% fee in EEA; 2.5%+€1 outside, 30 EEA countries only. Read our 2026 review!"
imToken Card,https://lh3.googleusercontent.com/d/17duo_gHZ4-GFWuj0xXVtHWDD1keNLGY_,Virtual + Physical,Mastercard Standard,Mastercard,,Standard,Self-custody,Virtual Free; Physical varies,Minimal to free,No,None,Yes (Apple Pay; Google Pay; Samsung Pay; WeChat Pay; Alipay),Yes,Global (expanding); NOT available in US or sanctioned countries,,Standard Mastercard rates,"USDC across 40+ blockchains including Arbitrum, Ethereum, Polygon; low Arbitrum fees for top-ups",None,Available with physical card,Based on account balance,Yes (Swiss IBAN via Fiat24; multi-currency USD/EUR/CHF/CNH),Swiss IBAN with multi-currency support; works with ANY crypto wallet; 40+ blockchain support; WeChat/Alipay integration,Switzerland/Europe focused; requires NFT minting for account; KYC required; limited crypto variety (primarily USDC),"imToken Card powered by Fiat24 brings Swiss banking infrastructure to 40+ blockchains, offering a multi-currency Mastercard supporting USD, EUR, CHF, and CNH with a Swiss IBAN. The first card that works with ANY crypto wallet—MetaMask, ThorWallet, SafePal, or your favorite wallet—spend USDC seamlessly from Arbitrum, Ethereum, Polygon, and dozens of other chains. Perfect for international users and Asian markets with WeChat Pay and Alipay integration, imToken Card bridges wallet-agnostic crypto spending with European banking reliability through regulated Swiss infrastructure.",FALSE,Fiat24 программа закончилась в апреле 2024,Fiat24 программа закончилась в апреле 2024,Fiat24 программа закончилась в апреле 2024,None,,,
Jupiter Card,https://lh3.googleusercontent.com/d/1rsMrstY9NcbBUe96qKCznFReASLB8C3u,Product does not exist,Not applicable,Other,,,DNA,Not applicable,Not applicable,Not applicable,Not applicable,Not applicable,Not applicable,Not applicable,,Not applicable,Not applicable,Not applicable,Not applicable,Not applicable,Not applicable,Community proposals only; product not launched,Product does not exist as of February 2026,"Jupiter Card exists only as community proposals on Jupiter DAO forums, with suggested features including Visa/Mastercard integration, JLP/USDC/SOL/BTC cashback, and Jupiter DEX aggregator integration for on-chain swaps. Multiple community members have proposed this concept since September 2025, but no official announcement or development timeline has been confirmed by the Jupiter team. If launched, it would theoretically offer Solana-native spending with Jupiter's best-in-class swap routing for instant conversion at checkout.",TRUE,₹100 для рефера + ₹50 для реферала после первой транзакции ₹300+,₹100 для рефера + ₹50 для реферала после первой транзакции ₹300+,₹100 для рефера + ₹50 для реферала после первой транзакции ₹300+,None,Review Jupiter Card,Jupiter Card Review 2026: 2% UPI Cashback & No FX Fees,"Jupiter Card — Not applicable, available globally. Read our 2026 review!"
Kardpay Card,https://lh3.googleusercontent.com/d/1Aea_DrGN5ztw37mFvZiNKp2Vvm9u93tq,Virtual prepaid cards,Visa + Mastercard prepaid,"Visa, Mastercard",Standard,Standard,Custodial,Varies by card denomination,None (prepaid),Yes: KDY token staking with attractive returns,KDY staking provides fee discounts,Yes (Apple Pay; Google Pay),Varies by card tier,Global acceptance,"Albania, Algeria, Andorra, Angola, Antigua and Barbuda, Argentina, Armenia, Australia, Austria, Azerbaijan, Bahamas, Bangladesh, Barbados, Belgium, Belize, Benin, Bhutan, Bolivia, Bosnia and Herzegovina, Botswana, Brazil, Brunei, Bulgaria, Burkina Faso, Burundi, Cambodia, Cameroon, Canada, Cape Verde, Chad, Chile, China, Colombia, Comoros, Congo, Costa Rica, Croatia, Cyprus, Czechia, Denmark, Djibouti, Dominica, Dominican Republic, Ecuador, Egypt, El Salvador, Equatorial Guinea, Estonia, Eswatini, Ethiopia, Fiji, Finland, France, Gabon, Gambia, Georgia, Germany, Ghana, Greece, Grenada, Guatemala, Guinea, Guinea-Bissau, Guyana, Haiti, Honduras, Hungary, Iceland, India, Indonesia, Ireland, Israel, Italy, Jamaica, Japan, Jordan, Kazakhstan, Kenya, Kiribati, Kuwait, Kyrgyzstan, Laos, Latvia, Lesotho, Liberia, Liechtenstein, Lithuania, Luxembourg, Madagascar, Malawi, Malaysia, Maldives, Malta, Marshall Islands, Mauritania, Mauritius, Mexico, Micronesia, Moldova, Monaco, Mongolia, Montenegro, Morocco, Mozambique, Namibia, Nauru, Nepal, Netherlands, New Zealand, Niger, Nigeria, North Macedonia, Norway, Oman, Pakistan, Palau, Palestine, Panama, Papua New Guinea, Paraguay, Peru, Philippines, Poland, Portugal, Qatar, Romania, Rwanda, Saint Kitts and Nevis, Saint Lucia, Saint Vincent and the Grenadines, Samoa, San Marino, Sao Tome and Principe, Saudi Arabia, Senegal, Serbia, Seychelles, Sierra Leone, Singapore, Slovakia, Slovenia, Solomon Islands, South Africa, South Korea, Spain, Sri Lanka, Suriname, Sweden, Switzerland, Tajikistan, Tanzania, Thailand, Timor-Leste, Togo, Tonga, Trinidad and Tobago, Tunisia, Turkey, Turkmenistan, Tuvalu, Uganda, Ukraine, United Arab Emirates, United Kingdom, United States, Uruguay, Uzbekistan, Vanuatu, Vatican City, Vietnam, Zambia",Standard network rates,Crypto payment; supports major cryptocurrencies for card purchase,None,Not applicable (prepaid cards),Based on prepaid card denomination purchased,No,No commitments; purchase prepaid cards directly with crypto; KDY staking for fee discounts; global gift card options,Prepaid model limits flexibility; must purchase cards in fixed denominations; fully custodial,"Kardpay revolutionizes crypto spending with instant prepaid Visa and Mastercard purchases directly from your crypto wallet—no commitments, no hidden fees, just pure spending freedom. Buy prepaid cards in various denominations using Bitcoin, Ethereum, or other major cryptocurrencies, plus access thousands of gift cards for popular retailers worldwide. Stake KDY tokens to earn attractive financial returns while enjoying significant discounts on card purchase fees, making Kardpay the ultimate borderless payment solution for crypto holders who want flexibility without ongoing subscriptions or verification hassles.",FALSE,"Реферальная программа была (596 победителей), но уже завершена","Реферальная программа была (596 победителей), но уже завершена","Реферальная программа была (596 победителей), но уже завершена",None,Review Kardpay Card,Kardpay Card Review 2026: EU Access & 0% FX,"Kardpay Card — Stake KDY token for attractive returns. Standard network rates, available globally. Read our 2026 review!"
Karta Card,https://lh3.googleusercontent.com/d/1tC2DmCna87LbkSTL5c3uSOeh_lA5bSY5,Virtual only (Telegram-native),Visa Signature,Visa,Signature,,Custodial,Free,Free,No,Referral: earn $5 per activated friend + 25% cashback in Karat on friend spending,Yes (Apple Pay; Google Pay),Yes,Most major regions (quick KYC process),"Antigua and Barbuda, Argentina, Bahamas, Barbados, Bangladesh, Belize, Bolivia (Plurinational State of), Brazil, Cayman Islands, Colombia, Costa Rica, Côte d'Ivoire, Dominican Republic, Dominica, Ecuador, Egypt, El Salvador, Ghana, Grenada, Guatemala, Guyana, Honduras, Kenya, Malaysia, Mexico, Morocco, New Zealand, Pakistan, Panama, Paraguay, Peru, Philippines, Saint Kitts and Nevis, Saint Lucia, Saint Vincent and the Grenadines, Senegal, South Africa, Sri Lanka, Suriname, Thailand, Trinidad and Tobago, Turks and Caicos Islands, United Arab Emirates, United States, Uganda, Uruguay, Zambia",Standard Visa Signature rates,Crypto-to-fiat conversion; instant USDT top-ups,Referral bonuses available,Available,Based on verification,No (but offers virtual USD accounts),Telegram-native card issued within chat; Visa Signature premium benefits (airport lounge; travel insurance); AI financial assistant,Virtual only; Telegram dependency; limited information on fees; Karat token rewards have uncertain value,"Karta Card brings banking to Telegram with a virtual Visa Signature card issued instantly within your favorite messaging app. Send money like messages to contacts, receive international transfers directly to your Karta balance, and manage everything through Karta AI—your intelligent financial assistant providing automated transactions and insights. Enjoy premium Visa Signature benefits including airport lounge access, travel accident insurance, and emergency medical coverage, all while earning $5 for each friend you refer plus 25% cashback in Karat tokens on their spending. Perfect for digital-native users who want seamless crypto-fiat integration without leaving Telegram.",TRUE,"Rewards после 3 действий реферала: KYC, топ-ап + карта, первая транзакция","Rewards после 3 действий реферала: KYC, топ-ап + карта, первая транзакция","Rewards после 3 действий реферала: KYC, топ-ап + карта, первая транзакция",25%,Review Karta Card,Karta Card Review 2026: Visa Signature & No FX Fees,"Karta Card — 0.25% cashback. Standard Visa Signature rates, available globally. Read our 2026 review!"
KAST Card,https://lh3.googleusercontent.com/d/1bRWupQK5aMWKs3_ys81SjpE0xpoJLm5E,Virtual + Physical (8 designs across 4 tiers),Visa Prepaid,Visa,Standard,,Custodial,Standard: Free virtual + $40 shipping; Premium/Limited/Luxe: included,Standard Free; Premium $1000/year; Limited $5000 one-time; Luxe $10000/year,Yes: Optional SOL staking for KAST Points rewards,2-8% KAST Points rewards (Standard 2%; Premium/Limited 5%; Luxe 8%),Yes (Apple Pay; Google Pay),Yes,"183 countries available; 46 restricted including US states, Russia, China, Canada, Australia",,2% FX fee on non-USD spending; 0% on USD spending,"USDT, USDC, PYUSD, USDe, RLUSD stablecoins (0% spread); BTC, ETH, SOL, XRP, BNB + 20 cryptos (2-5% conversion)",Spend $1000 in 30 days = $100 bonus,"$250 per withdrawal, $750/day max (3 withdrawals)",Unlimited up to available balance,No,0% fee on USD stablecoin spending; 8 premium card designs; instant virtual issuance; up to 8% rewards; VIP Concierge (higher tiers),Fully custodial; 2% FX fee negates Standard tier rewards; expensive ATM fees ($3 + 2%); funds not insured,"KAST Card delivers stablecoin-first global spending with eight stunning Visa card designs ranging from premium plastic to 24-karat gold-plated metal and solid gold editions. Earn 2-8% rewards in KAST Points with zero fees on USD stablecoin deposits, optional SOL staking for additional rewards, and instant virtual card activation. Choose from four tiers—Standard (free), Premium ($1,000/year with LED-illuminated designs), Limited ($5,000 one-time Founders Edition), or invite-only Luxe ($10,000/year with 37g solid gold card)—each offering VIP Concierge support and acceptance at 150+ million merchants across 183 countries for ultimate borderless financial freedom.",TRUE,"1,000 KAST points за трату $100+; 20,000 points за покупку Premium карты","1,000 KAST points за трату $100+; 20,000 points за покупку Premium карты","1,000 KAST points за трату $100+; 20,000 points за покупку Premium карты",Up to 8%,Review KAST Card,KAST Card Review 2026: 8% Cashback & 183 Countries,"KAST Card — Up to 8% cashback, opt. SOL staking rewards. 2% FX non-USD, 0% USD. Global (183 countries). Read our 2026 review!"
Kazepay Card,https://lh3.googleusercontent.com/d/1sVVmwR-RSPZrU3-sV3S2OWrHYSF172lN,Virtual + Physical,Visa + Mastercard Prepaid,"Visa, Mastercard",Standard,Standard,Custodial,Virtual Free; Physical requires KYC verification,Free,No,None,Yes (Apple Pay; Google Pay),KYC being implemented for all tiers,210+ countries (excludes OFAC-sanctioned regions),,Real-time market rates with small spread,"USDT, USDC stablecoins only",Referral program with uncapped bonuses,Physical card only; fees apply,Based on tier and verification,No,Zero transaction fees; 210+ country coverage; instant crypto-to-fiat conversion; multiple virtual cards,KYC being implemented for all cards soon; stablecoins only; no cashback; limited altcoin support,"Kazepay Card delivers privacy-focused stablecoin spending with instant virtual card generation and zero transaction fees across 210+ countries. Create multiple virtual cards under one account for budgeting control while enjoying real-time USDT and USDC conversion at market rates. With Apple Pay and Google Pay integration plus optional physical cards after KYC verification, Kazepay bridges the gap between crypto privacy and global payment accessibility—perfect for stablecoin holders seeking borderless financial freedom without conversion hassles.",TRUE,10% комиссия от использования реферала + 5% комиссия при покупке карты; реферал получает 5U voucher,10% комиссия от использования реферала + 5% комиссия при покупке карты; реферал получает 5U voucher,10% комиссия от использования реферала + 5% комиссия при покупке карты; реферал получает 5U voucher,None,Review Kazepay Card,KazePay Card Review 2026: 210+ Countries & UAE/Swiss Bonus,"Kazepay Card — Real-time rates w/ small spread, available in 210+ countries (excl. OFAC). Read our 2026 review!"
Kemy Card,https://lh3.googleusercontent.com/d/17mi69eI1q0J9p34JoF_QtTwNQhYxJKSY,Virtual + Physical,Visa + Mastercard Prepaid,"Visa, Mastercard",Standard,Standard,Custodial,Virtual included; Physical $250,Physical: $10/month,No,None,Yes (Apple Pay; Google Pay),Yes (full KYC with Sumsub ID + biometric),Global except US-sanctioned countries,"Afghanistan, Albania, Algeria, Andorra, Angola, Antigua and Barbuda, Argentina, Armenia, Australia, Austria, Azerbaijan, Bahamas, Bahrain, Bangladesh, Barbados, Belarus, Belgium, Belize, Benin, Bhutan, Bolivia, Bosnia and Herzegovina, Botswana, Brazil, Brunei, Bulgaria, Burkina Faso, Cape Verde, Cambodia, Cameroon, Canada, Chad, Chile, Colombia, Comoros, Costa Rica, Cote d'Ivoire, Croatia, Cyprus, Czechia, Denmark, Djibouti, Dominica, Dominican Republic, Ecuador, Egypt, El Salvador, Equatorial Guinea, Eritrea, Estonia, Eswatini, Ethiopia, Fiji, Finland, France, Gabon, Gambia, Georgia, Germany, Ghana, Greece, Grenada, Guatemala, Guinea, Guinea-Bissau, Guyana, Haiti, Honduras, Hungary, Iceland, India, Indonesia, Iraq, Ireland, Israel, Italy, Jamaica, Japan, Jordan, Kazakhstan, Kenya, Kiribati, Kosovo, Kuwait, Kyrgyzstan, Laos, Latvia, Lebanon, Lesotho, Liberia, Libya, Liechtenstein, Lithuania, Luxembourg, Madagascar, Malawi, Malaysia, Maldives, Mali, Malta, Marshall Islands, Mauritania, Mauritius, Mexico, Micronesia, Moldova, Monaco, Mongolia, Montenegro, Morocco, Mozambique, Myanmar, Namibia, Nauru, Nepal, Netherlands, New Zealand, Nicaragua, Niger, Nigeria, North Korea, North Macedonia, Norway, Oman, Pakistan, Palau, Panama, Papua New Guinea, Paraguay, Peru, Philippines, Poland, Portugal, Qatar, Romania, Russia, Rwanda, Saint Kitts and Nevis, Saint Lucia, Saint Vincent and the Grenadines, Samoa, San Marino, Sao Tome and Principe, Saudi Arabia, Senegal, Serbia, Seychelles, Sierra Leone, Singapore, Slovakia, Slovenia, Solomon Islands, Somalia, South Africa, South Korea, South Sudan, Spain, Sri Lanka, Sudan, Suriname, Sweden, Switzerland, Syria, Taiwan, Tajikistan, Tanzania, Thailand, Timor-Leste, Togo, Tonga, Trinidad and Tobago, Tunisia, Turkey, Turkmenistan, Tuvalu, Uganda, Ukraine, United Arab Emirates, United Kingdom, United States, Uruguay, Uzbekistan, Vanuatu, Vatican City, Venezuela, Vietnam, Yemen, Zambia, Zimbabwe",8% crypto top-up fee,"BTC, ETH, USDT, USDC and major cryptocurrencies",None,"Physical card: varies, high limits available",Virtual: $100000/month; Physical: up to $50000/day,No,Unlimited virtual card creation; very high spending limits ($100k/month virtual); global acceptance,Extremely high fees (8% crypto top-up + $10 monthly physical); $250 physical card fee; no rewards,"Kemy Card caters to high-volume crypto spenders with unlimited virtual card creation and exceptional spending limits reaching $100,000 monthly for virtual cards and $50,000 daily for physical. Support major cryptocurrencies including BTC, ETH, USDT, and USDC with full KYC protection through Sumsub biometric verification. While fees are premium (8% crypto conversion, $250 physical card, $10 monthly), Kemy delivers unmatched flexibility for businesses and individuals requiring substantial crypto-to-fiat spending power with Apple Pay and Google Pay integration across global Visa and Mastercard networks.",TRUE,$5 за виртуальную карту + $25 за физическую + 1% от топ-апов реферала (до 3 лет),$5 за виртуальную карту + $25 за физическую + 1% от топ-апов реферала (до 3 лет),$5 за виртуальную карту + $25 за физическую + 1% от топ-апов реферала (до 3 лет),None,,,
