Card Service,IMG,Card Type,Visa or Mastercard,Mastercard,Visa,Master Card,Custody,Card Issuance Fee,Annual Fee,APR/Investing/Vault,Cashback,Mobile Pay,KYC,Regions KYC Available,Countries Available,FX Fee,Top-up Methods,Sign-up Bonus,ATM Withdrawal Limit,Daily Spending Limit,IBAN/SWIFT/SEPA,Pros,Cons,Marketing Description,Ref ?,,,,Main Page Cashback,H1,Meta_title,Meta_description
1inch Debit Card,https://lh3.googleusercontent.com/d/1oh0XxB6ikV3US5r68lo7nGeUsikE6yLK,Virtual + Physical,Mastercard Standard,Mastercard,,Standard,Self-custody,Free,Free,CryptoDraft 0% APR up to 10% LTV; BXX staking yields 5-25% APY,1-2% (1% in BTC/USDT/1INCH or 2% in BXX),Yes,Yes,UK and EEA only,"United Kingdom, Austria, Belgium, Bulgaria, Croatia, Cyprus, Czechia, Denmark, Estonia, Finland, France, Germany, Greece, Hungary, Iceland, Ireland, Italy, Latvia, Liechtenstein, Lithuania, Luxembourg, Malta, Netherlands, Norway, Poland, Portugal, Romania, Slovakia, Slovenia, Spain, Sweden",0% (Mastercard standard rates apply),"BTC, ETH, LTC, XRP, 1INCH, BXX, USDT, USDC, EURT (9+)",None,High limits (€10k+ requires verification),"€8,000",No,Self-custody until purchase; 2% cashback with no staking; interest-free crypto credit,2% card spend fee + 1.75% conversion fee; UK/EEA only; BXX token has limited liquidity,The 1inch Card is a revolutionary Mastercard that lets you spend crypto while maintaining full self-custody until the moment of purchase. Earn up to 2% cashback on every transaction and access interest-free credit through the innovative CryptoDraft feature. Perfect for DeFi enthusiasts who want to bridge their digital assets with everyday spending without sacrificing control.,TRUE,Details,Details,Details,Up to 2%,Review 1inch Debit Card,1inch Card Review 2026: 2% Cashback & Self-Custody,"1inch Debit Card — Up to 2% cashback. 0% fee, available in UK & EEA. Read our 2026 review!"
Aisi Bank Card,https://lh3.googleusercontent.com/d/1sj0HaOE3pFeZnspx-wQgL7vH_epG3xBh,Virtual + Physical (in development),Not yet disclosed,Other,,,DNA,Not yet disclosed,Not yet disclosed,Under development,Not yet disclosed,Expected,Yes,Not yet disclosed,,Not yet disclosed,Not yet disclosed,Not yet disclosed,Not yet disclosed,Not yet disclosed,Yes (IBAN planned),Fully licensed Web3 banking with IBAN integration; early access available,Still in early development; limited public information available,"AISI Bank Card is an emerging Web3 banking solution that aims to bridge crypto and traditional finance through fully licensed banking infrastructure. Currently in active development with banking partnerships finalized and early access available. The platform will offer IBAN accounts, payment cards, and seamless integration between crypto activity and traditional banking services.",FALSE,"Общая реферальная программа 1inch существует (токены 1INCH), но конкретно под карту публичных условий нет","Общая реферальная программа 1inch существует (токены 1INCH), но конкретно под карту публичных условий нет","Общая реферальная программа 1inch существует (токены 1INCH), но конкретно под карту публичных условий нет",None,Review Aisi Bank Card,Aisi Bank Card Review 2026: Web3 & Multi-Chain,"Aisi Bank Card — Fee not disclosed, region TBD. Read our 2026 review!"
AmpBlack Card,https://lh3.googleusercontent.com/d/1ICset61LZ4_zD1qIfUU5wvdNSleKiExs,Data not available,Data not available,Other,,,DNA,Data not available,Data not available,Data not available,Data not available,Data not available,Data not available,Data not available,,Data not available,Data not available,Data not available,Data not available,Data not available,Data not available,Product does not exist or information unavailable,Product does not exist or information unavailable,No verified information available for this product. This card may not exist as a standalone product or may be under a different name.,FALSE,Не найдено,Не найдено,Не найдено,None,Review AmpBlack Card,AmpBlack Card Review 2026: Concierge & Lounge Access,"AmpBlack Card — Fee data unavailable, region unavailable. Read our 2026 review!"
Avalanche Card,https://lh3.googleusercontent.com/d/1Qob3WTTydrg--d56cfNPwDwnUz_tEThw,Virtual + Physical,Visa Standard,Visa,Standard,,Self-custody,Free,Free,0% APR credit; collateral earns native yields,AVAX rewards on purchases (rate varies),Yes,Yes,"USA (34 states), Latin America, Caribbean, 150+ countries",,1% advertised (2% for US users; up to 6% international),"USDC, USDT, AVAX, wAVAX (4)",None,No ATM access,Based on collateral (100% for stablecoins; 50% for AVAX),No,Zero fees; 0% APR; full self-custody; AVAX rewards; smart contract collateral,FX fees vary by region (up to 6%); 16 US states excluded; no ATM withdrawals; not FDIC insured,"Avalanche Card revolutionizes crypto spending with a self-custody Visa credit card backed by smart contract collateral. Hold your USDC, USDT, or AVAX in your own wallet and spend anywhere Visa is accepted with zero annual fees and 0% APR. Earn AVAX rewards on every purchase while maintaining complete control of your digital assets through Avalanche's blockchain infrastructure.",FALSE,Оба получают rewards; для 4% кэшбэка нужен минимум 1 реферал,Оба получают rewards; для 4% кэшбэка нужен минимум 1 реферал,Оба получают rewards; для 4% кэшбэка нужен минимум 1 реферал,Crypto rewards,Review Avalanche Card,Avalanche Card Review 2026: Self-Custody & AVAX Rewards,"Avalanche Card — Crypto rewards. 1% fee (2% US; up to 6% intl), available in USA (34 states), LatAm, Caribbean, 150+ countries. Read our 2026 review!"
Avici Card,https://lh3.googleusercontent.com/d/1dpfoq0bwE3nr6zJArR1UdU79kxqCQifb,Virtual + Physical,Visa Signature,Visa,Signature,,Self-custody,Free,Free,No cashback but USDC deposits can earn yield elsewhere,None,Yes,Yes,"USA (select states), Latin America, Africa, Asia-Pacific, Middle East","Antigua and Barbuda, Argentina, Australia, Bahamas, Barbados, Belize, Bolivia, Brazil, Cayman Islands, Colombia, Costa Rica, Côte d'Ivoire, Dominica, Dominican Republic, Ecuador, Egypt, El Salvador, Ghana, Grenada, Guatemala, Guyana, Hong Kong, Japan, Kenya, Malaysia, Mexico, Morocco, New Zealand, Pakistan, Panama, Paraguay, Peru, Philippines, Saint Kitts and Nevis, Saint Lucia, Saint Vincent and the Grenadines, Senegal, Singapore, South Africa, Suriname, Thailand, Trinidad and Tobago, Turks and Caicos Islands, United Arab Emirates, Uganda, Uruguay, USA, Zambia",0% Avici fee (only Visa's ~0.4-1% standard cross-border fee),"Multi-chain: Solana, Ethereum, Polygon, Arbitrum, Optimism, Base, BSC, Avalanche (40+ tokens)",None,Not available (virtual card focus),Up to available USDC collateral,Yes (USD/EUR virtual accounts with ACH/SEPA/Wire),Zero transaction fees; multi-chain support; Visa Signature benefits; true self-custody; automatic DEX conversion,No cashback rewards; requires 100% USDC collateral; limited geographic availability; early-stage platform,"Avici Card brings true self-custody to global payments with a Visa Signature card that never requires you to give up control of your crypto. Supporting 8+ blockchains with automatic token-to-USDC conversion, Avici offers zero transaction fees, premium Visa benefits, and integrated USD/EUR banking accounts. Spend confidently worldwide while your collateral remains securely in your own smart contract.",TRUE,Не найдено публичной реферальной программы для карты,Не найдено публичной реферальной программы для карты,Не найдено публичной реферальной программы для карты,None,Review Avici Card,Avici Signature Review 2026: Self-Custody & 0% FX,"Avici Card — 0% fee (Visa ~0.4-1% cross-border), available in USA (select states), LatAm, Africa, Asia-Pacific, Middle East. Read our 2026 review!"
Based Card,https://lh3.googleusercontent.com/d/1btOJ3tYMqugQieODB2cFaQsl5Itqqzu1,Virtual + Physical,Visa Prepaid,Visa,Standard,,Custodial,Free (varies by tier),"Gold $499, Free for Standard",No,Up to 1.5% (Gold tier),Yes (Apple Pay; Google Pay inconsistent),Yes,"100+ countries (excludes US, Mainland China); legacy Singapore/HK/Malaysia ending Nov 2025",,1% crypto-to-fiat conversion,"USDC, USDT, XSGD, other stablecoins (5+)",None,No ATM withdrawals,"$1,500/month Standard; $90,000/month Hype Card",No,Gasless deposits; no staking required for cashback; Hyperliquid trading integration,No ATM access; high Gold tier cost ($499); inconsistent Apple Pay; Singapore services discontinued,"Based Card delivers seamless crypto-to-fiat spending with Visa's global network across 100+ countries. Enjoy gasless stablecoin deposits, instant conversion at checkout, and up to 1.5% cashback on the Gold tier. Integrated with Hyperliquid for trading and available in both virtual and physical formats, Based Card makes spending your USDC and USDT effortless.",TRUE,Рефер: 20% от стоимости карты; Реферал: 10% скидка,Рефер: 20% от стоимости карты; Реферал: 10% скидка,Рефер: 20% от стоимости карты; Реферал: 10% скидка,,,BasedApp Card Review 2026: 1% Cashback & 0% FX,"Based Card (BasedApp) — N/A, available in N/A. Read our 2026 review!"
Binance Card,https://lh3.googleusercontent.com/d/1Rfvetl7PHYCMuAuN490y4zoASIyjZ-B4,Virtual + Physical,Visa Standard,Visa,Standard,,Custodial,Free,Free,Binance Earn products available (APR varies),Up to 8% BNB cashback (tiered by BNB holdings),Yes,Yes,EEA countries + select regions,"Austria, Belgium, Bulgaria, Colombia, Croatia, Czechia, Denmark, Estonia, Finland, France, Germany, Gibraltar, Greece, Hungary, Iceland, Ireland, Italy, Latvia, Liechtenstein, Lithuania, Luxembourg, Malta, Netherlands, Norway, Peru, Poland, Portugal, Republic of Cyprus, Romania, Russia, Slovakia, Slovenia, Spain, Sweden, Ukraine, United Kingdom",Varies by region,"BTC, BNB, BUSD, USDT and 10+ major cryptos",None,"Varies by region and tier, high limits available","Varies by tier based on BNB holdings, up to €8700/day for highest tier",No,Up to 8% cashback in BNB; zero card fees; backed by world's largest exchange; wide crypto support,8% cashback requires significant BNB staking; custodial model; geographic restrictions,"Binance Card seamlessly connects your Binance account to everyday spending at 60+ million merchants worldwide. Convert Bitcoin, BNB, and other cryptos instantly at point of sale with zero issuance or annual fees. Earn up to 8% cashback in BNB on every purchase, making this Visa card the ultimate companion for Binance users who want to maximize their crypto utility.",TRUE,За 3 друзей → 100 XSGD (условие: реферал тратит 500 XSGD в первый месяц),За 3 друзей → 100 XSGD (условие: реферал тратит 500 XSGD в первый месяц),За 3 друзей → 100 XSGD (условие: реферал тратит 500 XSGD в первый месяц),Up to 8%,Review Binance Card,Binance Card Review 2026: 8% Cashback & 0% FX,"Binance Card — Up to 8% cashback, Binance Earn (APR varies). Fees vary, available in EEA + select regions. Read our 2026 review!"
Bing Card,https://lh3.googleusercontent.com/d/1GMp00BGHesbbV16gFEdjFfC7U78PXnAb,Virtual + Physical,Visa + Mastercard (both virtual); Visa Platinum (physical),"Visa, Mastercard",Standard,Standard,Custodial,Virtual $129-299; Physical $599,None (3-year validity),No,None,Rolling out (Apple Pay + Google Pay),No (virtual cards); Yes (physical Platinum),"Worldwide (no restrictions mentioned, privacy-focused)","Algeria, Angola, Argentina, Australia, Austria, Bahrain, Bangladesh, Benin, Botswana, Brazil, Burkina Faso, Burundi, Cameroon, Canada, Cape Verde, Central African Republic, Chad, Chile, Colombia, Comoros, Congo, Costa Rica, Côte d'Ivoire, Djibouti, Dominican Republic, Ecuador, Egypt, El Salvador, Equatorial Guinea, Eritrea, Eswatini, Ethiopia, Gabon, Gambia, Ghana, Guatemala, Guinea, Guinea-Bissau, Honduras, India, Indonesia, Israel, Japan, Jordan, Kazakhstan, Kenya, Kuwait, Kyrgyzstan, Lesotho, Liberia, Madagascar, Malawi, Malaysia, Mali, Mauritania, Mauritius, Mexico, Mongolia, Morocco, Mozambique, Namibia, Nepal, New Zealand, Niger, Oman, Panama, Paraguay, Peru, Philippines, Qatar, Rwanda, Senegal, Seychelles, Singapore, South Africa, South Korea, Taiwan, Tanzania, Thailand, Togo, Tunisia, Uganda, United Arab Emirates, Uruguay, Vietnam, Zambia, Zimbabwe",1% on transactions under $10; otherwise 0% conversion fee,"BTC, ETH, USDT, USDC (4)",None,"Physical: ~$2,000/day; Virtual high tier: depends on level",Virtual Exclusive: $10k/month; Star: $100k/month; Premium: $200k/month; Physical Platinum: varies,No,No KYC for virtual cards; high spending limits ($100-200k/month); supports PayPal/Alipay/WeChat,Fully custodial; no crypto reversal; high issuance fees; no cashback; 1% deposit fee,"Bing Card offers privacy-focused prepaid cards with minimal verification requirements for virtual options. Supporting both Visa and Mastercard networks, users can spend BTC, ETH, USDT, and USDC globally with high monthly limits up to $200,000. Perfect for those seeking flexible crypto spending solutions with PayPal, Alipay, and WeChat Pay integration.",FALSE,До $100 на реферала + комиссионные скидки,До $100 на реферала + комиссионные скидки,До $100 на реферала + комиссионные скидки,None,Review Bing Card,Bing Card Review 2026: 100+ Countries & Privacy,"Bing Card — 1% fee under $10 (0% after), Worldwide. Privacy-focused. Read our 2026 review!"
BipTap Card,https://lh3.googleusercontent.com/d/1DGm9N3xSfkn0jxOk8LINWn6MvV9Dk5mH,Physical only,Visa + Mastercard,"Visa, Mastercard",Standard,Standard,Custodial,Black Plastic $300; Silver/Gold Metal $550; Black Metal $600,None mentioned,No,Available ($100-150 promo offers),Not specified,Not specified,200 countries,,"Not disclosed, likely 1-3%","ETH, BSC, SOL, TRON networks (major tokens 20+)",Up to $150 promotional cashback,"Available at 1M+ ATMs worldwide, limits vary by tier",No stated limit,"No (offshore banking solution, not traditional IBAN)",Global reach (200 countries); no spending limits; offshore banking coupled with crypto card,Very high entry fees ($300-600); 2.5% loading fee; monthly loading caps ($30-150k depending on tier),"BipTap presents the world's first crypto debit card coupled with an offshore bank account solution, enabling direct wallet loading across Ethereum, BSC, Solana, and Tron networks. With global acceptance at 61 million merchants and 1 million ATMs across 200 countries, BipTap offers true financial freedom with no spending limits—perfect for high-volume users seeking international payment flexibility.",TRUE,Не найдено,Не найдено,Не найдено,None,Review BipTap Card,BipTap Card Review 2026: 200 Countries & Custodial,"BipTap Card — Not disclosed (likely 1-3%), available in 200 countries. Read our 2026 review!"
Bit.Store Card,https://lh3.googleusercontent.com/d/1Kn1WK7TQgTCO8XOk_kHAH4yJ6NiCHKF9,Virtual (no-KYC) + Physical (KYC),Visa + Mastercard,"Visa, Mastercard",Standard,Standard,Custodial,Virtual $10; Physical varies,Free,No,Cryptoback rewards on physical card purchases,Yes,No (virtual); Yes (physical),150+ countries,"Austria, Belgium, Bulgaria, Croatia, Cyprus, Czechia, Denmark, Estonia, Finland, France, Germany, Greece, Hungary, Iceland, Ireland, Italy, Latvia, Liechtenstein, Lithuania, Luxembourg, Malta, Netherlands, Norway, Poland, Portugal, Romania, Slovakia, Slovenia, Spain, Sweden, United Kingdom, Switzerland, Argentina, Brazil, Canada, Chile, Colombia, Mexico, Peru, Australia, Bangladesh, Hong Kong, India, Indonesia, Malaysia, New Zealand, Philippines, Singapore, Thailand, Vietnam, Egypt, Kenya, Nigeria, South Africa, UAE, Saudi Arabia","2.5% crypto-to-fiat conversion fee, then standard network FX","BTC, ETH, USDT, USDC, BRC-20 tokens (40+ cryptos)",None,"Available with physical card, limits vary",Virtual: $10k/month; Physical: €100k/month,No,Supports 40+ cryptocurrencies; no-KYC virtual option; cryptoback rewards; Telegram bot integration,2.5% conversion fee; fully custodial; no crypto reversal once loaded; $15 minimum load,"Bit.Store Card bridges Web3 and traditional payments with support for 40+ cryptocurrencies including BRC-20 tokens. Choose a no-KYC virtual card for privacy with $10,000 monthly limits, or upgrade to a physical card with €100,000 monthly capacity and cryptoback rewards. Integrated with Apple Pay, Google Pay, and Telegram for ultimate convenience.",TRUE,Дополнительные rewards за каждого друга на основе их транзакций,Дополнительные rewards за каждого друга на основе их транзакций,Дополнительные rewards за каждого друга на основе их транзакций,Crypto rewards,Review Bit.Store Card,Bit.Store Card Review 2026: Crypto Rewards & 150+ Countries,"Bit.Store Card — Crypto rewards. 2.5% fee, available in 150+ countries. Read our 2026 review!"
Bitget Card,https://lh3.googleusercontent.com/d/1_wJ6Kdv13WZ68pYHslW3v4kl7QV60Jq1,Virtual + Physical,Visa Platinum,Visa,Platinum,,Custodial,Free,Free,Bitget Earn products available with variable APY,Up to 8% in BGB tokens (5% planned for standard users),Yes (Google Pay; Apple Pay),Yes,"EEA, select Asia-Pacific countries, 180+ countries globally","Argentina, Australia, Brazil, Chile, China, Colombia, Ecuador, El Salvador, Guatemala, Japan, Malaysia, Mexico, Panama, Peru, Philippines, Singapore, South Korea, Taiwan, Thailand, United Kingdom",0.9% transaction fee + Visa FX rates on non-USD transactions,BTC ETH XRP USDT USDC TON BNB and 10+ major cryptos,Promotional campaigns available,Available at Visa ATMs worldwide; 2% fee after first withdrawal,Up to €5000/day standard; €3M/month highest tier,No,Up to 8% cashback in BGB; no spending limits for VIP users; instant virtual card issuance,By invitation only for VIP institutional clients; 0.9% transaction fee on every purchase; limited public availability,"Bitget Card is an exclusive Visa Platinum card designed for Bitget VIP institutional clients, offering unparalleled spending freedom with customizable limits up to $3 million monthly. Earn up to 8% cashback in BGB tokens while enjoying instant crypto-to-fiat conversion across 180+ countries. With compatibility across Apple Pay and Google Pay, plus instant virtual card issuance, Bitget Card delivers premium financial flexibility for high-volume crypto users.",TRUE,20% от комиссий платформы за транзакции реферала (2 года),20% от комиссий платформы за транзакции реферала (2 года),20% от комиссий платформы за транзакции реферала (2 года),Up to 8%,Review Bitget Card,Bitget Card Review 2026: 8% Cashback & Zero Fees,"Bitget Card — up to 8% cashback, earn variable APY. 0.9% transaction fee, available globally. Read our 2026 review!"
Bitpanda Card,https://lh3.googleusercontent.com/d/1IopT8SEepBqCc-T_-zkdXXgr4VkLkRtY,Virtual + Physical,Visa Platinum,Visa,Platinum,,Custodial,Free (€5.90 replacement),Free,No dedicated yield; can hold assets in Bitpanda Savings,1% cashback on crypto purchases only (no cashback on EUR/stablecoins/metals/stocks),Yes (Apple Pay; Google Pay; Samsung Pay),Yes,Eurozone countries only (19 countries),,0% Bitpanda FX fee (only Visa standard rates),200+ cryptocurrencies plus precious metals and stocks from Bitpanda account,None,"€350/day, €1.50 per withdrawal",€10000/day,No,"Multi-asset spending (crypto, metals, stocks); 1% crypto cashback; no monthly fees; seamless Bitpanda integration",Eurozone only; 1-1.5% conversion spread on every transaction; €1.50 ATM fee; each transaction creates taxable event,"Bitpanda Card transforms your investment portfolio into spending power with a Visa Platinum debit card that supports 200+ cryptocurrencies, precious metals, and even stocks. Enjoy instant real-time conversion at checkout with 1% crypto cashback, zero monthly fees, and 0% FX surcharges across the Eurozone. Perfect for European investors who want seamless access to their diverse Bitpanda holdings for everyday purchases without manual conversions.",TRUE,"До €100 бонуса (€10 за первые €1,000 инвестиций реферала)","До €100 бонуса (€10 за первые €1,000 инвестиций реферала)","До €100 бонуса (€10 за первые €1,000 инвестиций реферала)",1%,Review Bitpanda Card,Bitpanda Card Review 2026: 1% Cashback & 0% FX,"Bitpanda Card — 0.01% cashback. 0% fee, available in Eurozone. Read our 2026 review!"
BitPay Card,https://lh3.googleusercontent.com/d/1atzgjQRFSNSZLHc0SR0Rkfwu7Q2jTcV1,Virtual only (physical discontinued),Mastercard Standard,Mastercard,,Standard,Custodial,Free,Free,No,None (previously had promotional offers),Yes (Apple Pay; Google Pay),Yes,USA only,,"0% foreign transaction fees, Mastercard standard conversion rates","BTC, ETH, LTC, BCH, DOGE, DAI, USDC, USDT (8+)",None,Not available (virtual only),Based on loaded balance,No,Instant crypto-to-fiat conversion; no foreign transaction fees; widely accepted Mastercard network,US only; new applications paused (revamping program); no cashback; virtual only; limited crypto selection,"BitPay Card pioneered crypto spending in the United States with instant Bitcoin-to-dollar conversion at millions of Mastercard merchants worldwide. Load your card with BTC, ETH, DOGE, or stablecoins and spend instantly online or in-store via Apple Pay and Google Pay. While new applications are currently paused for program improvements, existing users continue enjoying zero foreign transaction fees and seamless crypto utility for everyday purchases.",TRUE,$10 тебе + $10 рефералу после пополнения $100,$10 тебе + $10 рефералу после пополнения $100,$10 тебе + $10 рефералу после пополнения $100,None,Review BitPay Card,BitPay Card Review 2026: No Annual Fee & 0% FX USA,"BitPay Card — 0% foreign fees, Mastercard rates, USA only. Read our 2026 review!"
Bitrefill Card,https://lh3.googleusercontent.com/d/1fb8CV1sM3E-vSrrySVTMZ7hHmT6eVdG_,Virtual + Physical,Visa Standard,Visa,Standard,,Custodial,Virtual Free; Physical €9.90,Free,No,None,Yes (Google Pay; Apple Pay planned),Yes (3 tiers: Starter/Plus/Freedom),EU/EEA only (27 countries),"Austria, Belgium, Bulgaria, Croatia, Cyprus, Czechia, Denmark, Estonia, Finland, France, Germany, Greece, Iceland, Ireland, Italy, Latvia, Lithuania, Luxembourg, Malta, Netherlands, Norway, Poland, Portugal, Romania, Slovakia, Slovenia, Spain, Sweden",1.99% crypto-to-EUR conversion fee; 0% on EUR purchases,"BTC (on-chain + Lightning), ETH, USDC, BNB (4)",None,"Available with physical card, fees apply after limits",€10000/day (varies by tier),Yes (SEPA cash-out available),Supports Bitcoin Lightning Network; SEPA bank transfers available; transparent 1.99% conversion fee,EU/EEA only; no cashback; €9.90 physical card fee; 1.99% conversion on all crypto deposits,"Bitrefill Card brings lightning-fast crypto payments to European daily life with full Bitcoin Lightning Network support for instant, low-cost deposits. Convert BTC, ETH, USDC, or BNB to euros with a transparent 1.99% fee and spend at 50+ million Visa merchants across the EU/EEA. With tiered verification offering up to €500,000 lifetime deposits and SEPA cash-out capability, it's the straightforward crypto-to-fiat bridge without complex rewards or hidden fees.",TRUE,$10 каждому после трат $100 рефералом,$10 каждому после трат $100 рефералом,$10 каждому после трат $100 рефералом,None,Review Bitrefill Card,Bitrefill Card Review 2026: EU Only & No Fees,"Bitrefill Card — 1.99% crypto-to-EUR fee; 0% EUR purchases, available in EEA. Read our 2026 review!"
