Text,Image URL,Tags,Posting Time
"You're still getting 1% cashback in fiat? That’s cute. 😬 Imagine getting paid in Bitcoin every time you buy groceries or a coffee. Sound like a cheat code? It is. #cryptocard 
Which token do you want your cashback in? 👇","[PROMPT: A meme showing a tiny ""1% bank cashback"" vs a giant muscular ""8% crypto cashback"" dog.]",#cryptocard,2026-05-15 09:24
"🥷 Need total privacy? **OffGrid Card** gives you dynamic rotating virtual cards with zero KYC required. Pay anywhere and disappear. The ultimate cypherpunk spending tool. 🕶️ Check sweepbase. #cryptocard
Is privacy the most important feature of crypto?",[PROMPT: A shadowy figure holding a glowing virtual card that is constantly scrambling its numbers.],#cryptocard,2026-05-15 18:22
"Custodial vs Non-Custodial Cards: A quick guide. 📖 Custodial (like Binance/Coinbase) is easier and has better perks. Non-Custodial (like Gnosis/Avici) gives you 100% control of your keys. Choose wisely. #cryptocard
Which side are you on?","[PROMPT: A Boxing match graphic. ""Corner 1: Custodial Convenience"" vs ""Corner 2: Non-Custodial Security"".]",#cryptocard,2026-05-16 08:15
"🌐 Spend crypto anywhere in 170+ countries while stacking a 5% welcome bonus? **Kolo Card** works on Polygon, Arbitrum, and even supports memecoins like $PEPE. 🐸 Only at sweepbase! #cryptocard
Are memecoins the future of daily payments?",[PROMPT: A vibrant Kolo card traveling across a stylized map of the world.],#cryptocard,2026-05-16 18:31
"Me checking my bank account: Depression. 📉
Me checking my #cryptocard app and seeing my staking rewards paid out daily: Euphoria. 🌈
Does watching numbers go up bring you joy?","[PROMPT: The Two Buttons meme. Red button: ""Traditional Bank App"". Blue button: ""Crypto Card App with Yield"". A sweeping hand aggressively hits the blue button.]",#cryptocard,2026-05-17 08:56
"💎 If you want an 8% cashback card that literally comes plated in 24k gold, look at the **KAST Card**. Stablecoin-first spending, high limits, and VIP concierge service. Absolute premium. ✨ Only at sweepbase. #cryptocard
Does the look of the physical card matter to you?","[PROMPT: A stunning, heavy 24-karat gold KAST card reflecting light on a dark marble table.]",#cryptocard,2026-05-17 18:17
"Traditional banking is 9-to-5. Blockchain is 24/7/365. Why is your debit card still clinging to legacy banking hours? Get a #cryptocard and bypass the weekend maintenance windows. ⏳
What's the worst time your bank app has gone ""down for maintenance""?","[PROMPT: A ""Closed for the Weekend"" sign hanging on a bank door, while a glowing crypto terminal next to it reads ""Active 24/7"".]",#cryptocard,2026-05-18 08:17
"Your legacy bank makes billions lending out your deposits, and pays you 0.05%. 🤡 A Web3 #cryptocard pays you 5-10% because YOU are the liquidity provider. Reclaim your yield. 🌾
Why is society okay with banks taking 99% of the yield?","[PROMPT: A bank executive taking a massive piece of pie, handing the user a tiny crumb.]",#cryptocard,2026-05-18 17:29
"🥇 Gold, Silver, Tesla Stock, or Bitcoin... why not pay with all of them? The **Bitpanda Card** lets you spend from any 200+ assets in your portfolio instantly at checkout. 🤯 #cryptocard
Which asset would you spend first?","[PROMPT: A gold bar, an Apple stock certificate, and a Bitcoin morphing together into a debit card.]",#cryptocard,2026-05-19 09:01
"Here is why metal cards exist in Web3: When a startup doesn't have to spend $100M on physical bank branches and thousands of tellers, they can afford to give you a 22-gram solid steel #cryptocard for free. 🏛️🔨
Is a metal card a dealbreaker for you?","[PROMPT: A bulldozer clearing away a traditional bank branch to make room for a giant, beautiful metal card.]",#cryptocard,2026-05-19 17:54
"Tired of providing your passport, utility bill, and blood type just to open an account? The new meta is zero-KYC virtual cards. Instant privacy, global spending. 🕶️ #cryptocard
Is KYC a necessary evil or complete overreach?","[PROMPT: A person tossing a pile of identity documents into a paper shredder, holding up a glowing anonymous crypto card.]",#cryptocard,2026-05-20 08:45
"No more ""Where is your nearest branch?"" Your nearest branch is the smartphone in your pocket. Self-custody + #cryptocard = Complete financial autonomy. 📱🌍
When was the last time you actually stepped inside a physical bank?","[PROMPT: A physical bank branch looking old and dusty, covered in cobwebs, while a bright futuristic smartphone shines in the foreground.

### ✈️ Digital Nomads & Travel (31-45)]",#cryptocard,2026-05-20 17:22
"The ultimate flex isn't a Black Card anymore. It's a #cryptocard connected directly to your Gnosis Safe. Multi-sig security for your grocery runs. 🛡️🔐 
Is multi-sig overkill for daily spending, or completely necessary?",[PROMPT: Three interlocking digital keys opening a vault that contains a glowing Visa terminal.],#cryptocard,2026-05-21 08:45
"🎡 Feel lucky? The **Fold Card** lets you spin a daily wheel to win up to 1 full $BTC on your purchases! The premier Bitcoin-rewards credit card with zero FX fees. 🧡 #cryptocard
Would you spin the roulette wheel on every purchase?","[PROMPT: A neon spinwheel showing percentages of cashback, with a massive ""1 BTC Jackpot"" slice.]",#cryptocard,2026-05-21 18:27
"🌍 **Bit.Store Card** links Web3 to standard payments natively for over 150 countries. Supporting BRC-20 tokens and offering a no-KYC virtual option. Ultimate global access. 📱 Only at sweepbase! #cryptocard
Do you use physical cards or strictly Apple/Google Pay?",[PROMPT: A glowing virtual Bit.Store card hovering over a global map pointing to 150+ pins.],#cryptocard,2026-05-22 08:25
"Cashing out crypto shouldn't feel like a heist. Forget P2P scams and 5-day bank wire delays. Swipe a #cryptocard and your crypto is fiat instantly at the terminal. ⚡
How do you usually off-ramp your gains?","[PROMPT: A side-by-side comparison. Left: ""Old Off-Ramp"" (stressed guy looking at charts & bank holds). Right: ""New Off-Ramp"" (smiling person tapping an Apple Pay terminal).]",#cryptocard,2026-05-22 17:25
"Waking up. Checking charts. Tapping the #cryptocard for an espresso. Surviving the bear market one coffee at a time. ☕🐻
Are you a bear market builder or a bull market tourist?","[PROMPT: A tired-looking trader clutching a coffee cup, with a crypto card glowing faintly in their pocket, surrounded by red candles.


### 🧠 Deep Dives, Tips & Comparisons (56-80)]",#cryptocard,2026-05-23 09:17
"Some #cryptocard options now offer ""Subscription Management"". You can see all your active Netflix, Spotify, and gym memberships stored on-chain and cancel them with one click. 🎯
How much money do you waste on forgotten subscriptions?","[PROMPT: A sleek dashboard showing a list of subscriptions with a giant red ""Cancel All Unused"" button.]",#cryptocard,2026-05-23 17:23
"The best cards give you the option to choose: cashback in $BTC, $ETH, or stablecoins. Market dipping? Earn in stables. Bull run? Stack sats. The ultimate flexibility. 📈🔥 #cryptocard Check sweepbase to find your match.
Which one are you choosing right now?","[PROMPT: A glowing fork in the road. Left path: ""Stables"". Right path: ""BTC/ETH"", with a sleek card floating in the middle.]",#cryptocard,2026-05-24 09:23
"The ""Card Issuance Fee"" scam. 🚩 Stop paying $50 just to get a physical piece of plastic. The market is too competitive. Only use a #cryptocard that offers free virtual AND physical issuance. Check sweepbase!
Did you pay a fee for your current card?","[PROMPT: A red flag waving over a bill that says ""Physical Card Processing Fee: $49.99"".]",#cryptocard,2026-05-24 17:31
"🇺🇸 US Users, this is for you. The **Coinbase Card** lets you swipe your $USDC or even $DOGE at millions of locations, giving up to 4% back in crypto rewards. Easy and reliable. 💰 #cryptocard
Which coin are you selecting for cashback?","[PROMPT: A blue Coinbase card sliding into a payment terminal, dispensing various crypto logos as ""cashback"".]",#cryptocard,2026-05-25 08:31
"Have you noticed how traditional banks randomly freeze your cards when you travel, but a good #cryptocard works seamlessly in 150+ countries? They don’t want you to have freedom. 🌍
Ever had your bank card declined abroad? Let’s hear your horror stories!","[PROMPT: A traditional bank card frozen inside an ice cube next to a vibrant, glowing crypto card.]",#cryptocard,2026-05-25 18:39
"Imagine Visa/Mastercard, but zero middlemen holding your bags. Web3 debit cards are cutting out the custodial risk entirely. You sign the transaction, the terminal gets fiat. Magic. 🪄 #cryptocard
Would you trust a fully decentralized card?","[PROMPT: A visual flow chart. ""You -> Smart Contract -> Terminal"". The ""Bank"" icon is crossed out with a giant red X.]",#cryptocard,2026-05-26 09:15
"You want to pay in euros, but you only have $USDC on Arbitrum. No problem. The right #cryptocard swaps it instantly at checkout for fractions of a cent. Magic internet money is real. 🪄
Which L2 network is your favorite for cheap fees?",[PROMPT: The Arbitrum logo zipping through a fiber-optic cable and emerging out the other side as Euro coins.],#cryptocard,2026-05-26 18:25
"Digital nomads, listen up! Landing in a new country, opening your wallet, and using a #cryptocard funded with $USDT instantly without looking for a currency exchange booth is peak freedom. 🌍✈️ Check sweepbase for the best nomad cards!
What country are you currently working from?","[PROMPT: Someone sitting on a beach with a laptop, effortlessly tapping a crypto card on a waiter's payment terminal.]",#cryptocard,2026-05-27 08:36
"Have you ever tried to open a local bank account as a foreigner? The bureaucracy is a nightmare. Skip the paperwork. A global #cryptocard works 150+ countries out of the box. 📦🌍
What's the hardest country to get a bank account in?","[PROMPT: A giant mountain of paperwork required to open a bank account, vs a single frictionless crypto card.]",#cryptocard,2026-05-27 17:48
"💰 **Nexo Card** brings the dual-mode revolution. Switch between ""Debit"" (spend your balance) and ""Credit"" (borrow against crypto) instantly in the app. Earn up to 2% cashback either way. 📊 #cryptocard
Do you prefer debit or credit for your daily spending?","[PROMPT: A toggle switch in an app UI flipping from ""Debit Mode"" to ""Credit Mode"", unlocking cashback coins.]",#cryptocard,2026-05-28 09:22
"Some #cryptocard options out there are giving up to 8% cashback. 🤯 If you spend $2,000 a month, that's $160 in free crypto every 30 days. Let your money make you money.
Would you rather have 8% in volatile crypto or 2% in stablecoins? 👇",[PROMPT: A glowing calculator showing $160 monthly passive income next to a premium metal card.],#cryptocard,2026-05-28 18:32
"Metal cards just hit different. Throwing down a 22-gram stainless steel #cryptocard on the table to pay the bill is the ultimate subtle flex. 💪✨
Plastic, Metal, or just Apple Pay? What's your style?","[PROMPT: A high-quality macro shot of a heavy, laser-engraved metal card hitting a wooden restaurant table, creating a slight spark.

### 🥷 Privacy & Self-Custody (16-30)]",#cryptocard,2026-05-29 09:09
"💳 8% cashback on all purchases. Sounds like a scam? For **Binance Card** users, it’s just Tuesday. Directly linked to your exchange account with zero issuance fees. Only at sweepbase. 📈 #cryptocard
What is your current VIP tier on Binance?",[PROMPT: Bar chart. Bank: 1-2%. Binance Card: Huge glowing yellow 8%.],#cryptocard,2026-05-29 17:42
"Earning a living internationally? Receiving international wires costs $30. Receiving USDT costs $1. Swipe it instantly on your card. Global payroll solved. 💼🌐 #cryptocard
Freelancers, how do you receive global payments?",[PROMPT: A visual pipeline: Freelancer -> USDT -> Crypto Card -> Groceries. Zero friction.],#cryptocard,2026-05-30 08:33
"Do you have a large crypto following? Look into #cryptocard affiliate programs. Some pay you 10-20% of the trading fees of anyone who signs up using your card link. Build passive income. 🤝💸
Are you utilizing affiliate networks?","[PROMPT: A flowchart showing ""Your Link -> Friend Signs Up -> You Get Passive Fees"".]",#cryptocard,2026-05-30 17:15
"Beware the ""Weekend FX markup"". Legacy banks charge you an extra 1% if you buy things abroad on a Sunday because markets are closed. Blockchain is 24/7. ⏳ #cryptocard
Did you know about the weekend banking scam?","[PROMPT: A sign on a traditional bank saying ""Weekend Surcharge: 1%"", crossed out with red paint.]",#cryptocard,2026-05-31 08:28
"Euro spenders: Always use a card that natively settles in EUR if you are actively traveling heavily in the EEA. Double conversion (Crypto -> USD -> EUR) will eat exactly 1.5% of your bags. 💶 #cryptocard
Are you optimizing your currency routes?","[PROMPT: An infographic showing the ""Double Conversion Trap"" vs a direct ""Crypto to Euro"" bridge.]",#cryptocard,2026-05-31 17:30
"Coinbase Card vs Binance Card? 🤔 Coinbase gives you flexibility in the US, but Binance Card hits you with up to 8% cashback globally. Which giant are you rolling with? #cryptocard
Both have zero issuance fees. Check sweepbase for the full breakdown.","[PROMPT: A stylized boxing ring. In one corner, a glowing blue card (Coinbase style); in the other, a bright yellow card (Binance style).]",#cryptocard,2026-06-01 08:31
"Debit mode vs Credit mode on Nexo. Debit spends your stablecoins. Credit borrows against your BTC so you don't trigger a tax event. The ultimate toggle switch. 🎚️ #cryptocard
How do you structure your daily spending?","[PROMPT: A mechanical switch. ""Left: Sell Crypto"". ""Right: Borrow Fiat"". Hand is pushing it to the right.]",#cryptocard,2026-06-01 17:17
"Some #cryptocard platforms cap your rewards at $50/month. Always read the fine print! The best cards have unlimited cashback or very high monthly ceilings ($500+). 🛑💸
Have you ever hit a cashback monthly limit?",[PROMPT: A glass ceiling shattering as glowing Bitcoin cashback bursts through it.],#cryptocard,2026-06-02 08:58
"Plutus Card offers perks like Aldi, Lidl, and Tesco rebates for EU residents. Earning crypto just for buying cheap groceries natively is the ultimate bear market survival tactic. 🛒🐻 #cryptocard
Do you shop at discount supermarkets?","[PROMPT: A shopping cart filled with generic brand groceries, radiating an aura of premium crypto wealth.]",#cryptocard,2026-06-02 17:30
"Groceries are boring. Earning $10 in Ethereum while buying groceries is exciting. It completely gamifies your daily financial existence. 🥦💰 #cryptocard
Has earning crypto changed your spending habits?","[PROMPT: A stylized video game UI overlaying a real-life supermarket aisle, showing ""+10 ETH XP"" floating up.]",#cryptocard,2026-06-03 09:23
"""I don't trust stablecoins, I only hold Bitcoin."" That’s fine! Some #cryptocard apps offer 3-5% APY directly on your raw BTC holdings while keeping it available for card spending. Stack sats passively. 🟧⚡
Are you yielding your Bitcoin or keeping it cold?","[PROMPT: A large physical Bitcoin resting on a pedestal, emitting a soft, warm glow of passive interest.]",#cryptocard,2026-06-03 18:18
"Traditional banks hide a sneaky 2-3% markup on the exchange rate, then charge you a ""$5 foreign transaction fee"" on top. Stop getting scammed. Good crypto cards use pure Visa rates. 🛑 #cryptocard
Check sweepbase for true 0% FX cards!","[PROMPT: A bank contract with invisible ink being revealed by a blacklight, showing hidden fees.]",#cryptocard,2026-06-04 08:48
"Don't be the guy at the group dinner asking if the restaurant takes foreign bank cards. Just throw down the metal #cryptocard and let the Visa/Mastercard network do the heavy lifting in 180 countries. 🍽️
Who usually pays the bill in your group?","[PROMPT: A glowing card hitting a restaurant tray, creating a shockwave.]",#cryptocard,2026-06-04 18:44
"Thailand, Bali, Portugal. If you are swiping your home country's bank card here, you are losing hundreds of dollars a month to conversion spread. Switch to stablecoins. 🏝️💸 #cryptocard
What's the worst FX rate you've ever paid?",[PROMPT: A digital nomad looking shocked at an ATM receipt on a beautiful Thai beach.],#cryptocard,2026-06-05 09:13
"Using local food delivery apps in Asia or LatAm? Hook up a virtual #cryptocard. No foreign transaction blocks, pure stablecoin off-ramping. 🍜🛵
What's your favorite foreign food delivery app?","[PROMPT: A futuristic delivery scooter carrying noodles, with a crypto payment confirmation popping up above it.]",#cryptocard,2026-06-05 17:58
"The ultimate yield-spending loop: 
Earn salary -> Stake USDC at 8% -> Earn 2% cashback via #cryptocard -> Re-stake the cashback. Compounding loops are the secret to Web3 wealth. ♾️💸
Are you exploiting the compounding loop?","[PROMPT: A glowing infinity symbol made of digital coins, continuously feeding into a Visa card and looping back.]",#cryptocard,2026-06-06 09:04
"OKX Card or Bybit Card? 🇪🇺 Both are massive in Europe right now. Bybit ties rewards to VIP levels without staking, OKX offers zero FX fees and tiny conversion spread. ⚖️ #cryptocard
Which ecosystem feels stickier?",[PROMPT: A balanced scale showing a black card (OKX) on one side and a gold/black card (Bybit) on the other.],#cryptocard,2026-06-06 17:26
"Why does your checking account pay 0.01% APY when a #cryptocard wallet can pay 5-10%? Because banks steal your yield. Keep it in stablecoins, earn the yield, spend via card. 🩸🏦
Are you still holding cash in a traditional checking account?","[PROMPT: A vampire (banker) sucking the life out of a 5% yield bag, leaving only a 0.01% drop.]",#cryptocard,2026-06-07 08:19
"Stablecoins are the ultimate FX hedge. If you live in a country with heavy currency inflation, load up a #cryptocard in USDC, and spend it locally. You beat inflation instantly. 🛡️
Has crypto protected your purchasing power?","[PROMPT: A shield made of USDC deflecting arrows labeled ""Inflation"" and ""Devaluation"".]",#cryptocard,2026-06-07 17:26
"""I use my credit card for the fraud protection."" Good news: Most top-tier Visa/Mastercard #cryptocard options carry the exact same Zero Liability fraud protection as legacy banks. Safety first. 🛡️
Have you ever done a chargeback on a crypto purchase?","[PROMPT: A glowing Visa shield blocking a hacker's grasping hands.

### 📈 APY & Passive Yield (176-200)]",#cryptocard,2026-06-08 08:41
"Virtual vs Physical. 90% of crypto users only use Apple/Google Pay now. Do you even need the physical #cryptocard anymore, or is it just a novelty? 📱💳
When was the last time you swiped plastic?","[PROMPT: A graveyard showing a tombstone labeled ""Physical Plastic"" with a glowing smartphone rising above it.]",#cryptocard,2026-06-08 18:41
"Are you paying for a premium travel card just to avoid FX fees? Many basic tier #cryptocard options offer 0% FX fees with zero annual fee. ✈️ Cancel the bank plastic. 
How much is your bank card's annual fee?",[PROMPT: Scissors cutting a premium traditional credit card in half.],#cryptocard,2026-06-09 09:06
"A 4% cashback in a coin that dumps 50% overnight is actually a 2% cashback. Always choose cards that let you earn rewards in USDT, USDC, or immediately convert to stables! 💵📉 #cryptocard
Do you hold your reward tokens or dump them instantly?","[PROMPT: An animated coin graph dropping rapidly, caught safely in a ""USDC Parachute"".]",#cryptocard,2026-06-09 17:39
"The magic of Daily Payouts. Traditional banks pay you interest once a month. Good #cryptocard platforms pay you your yield every 24 hours. You can literally watch your spending power grow daily. 🌅💰
Do daily payouts motivate you to save more?",[PROMPT: A timelapse visual: A small plant on a card growing a new golden leaf every single sunrise.],#cryptocard,2026-06-10 09:42
"The beauty of receiving your cashback daily: You can instantly re-stake those rewards into a DeFi protocol to earn APY on your cashback. Compounding interest is the 8th wonder of the world. 🌍🔁 #cryptocard
Do you compound or cash out your rewards?","[PROMPT: A snowball rolling down a hill made of charts, gathering more and more crypto coins as it goes.]",#cryptocard,2026-06-10 18:28
"How to beat the travel tax: 1. Hold USDC. 2. Connect to an OKX or Binance card. 3. Swipe normally. The interbank exchange rate is applied instantly. 🛡️ #cryptocard
What's your travel card setup?","[PROMPT: A checklist with green checkmarks next to ""Hold USDC"", ""0% FX Card"", ""Travel the World"".]",#cryptocard,2026-06-11 09:06
"Imagine walking into a store and the coffee costs $4. But because your wallet generated $5 in yield overnight, the coffee was mathematically free. #cryptocard ☕✨
Has your passive income ever covered your daily expenses?","[PROMPT: A receipt for a $4 coffee that shows a discount applied: ""Covered by overnight yield = $0.00"".]",#cryptocard,2026-06-11 17:48
"Paying for a wedding with a #cryptocard. $30,000 expense = $600 to $1,500 back in Bitcoin. You literally financed your honeymoon with the cashback. 👰✈️ Check sweepbase for high limit cards!
What's the largest single swipe you've ever done?","[PROMPT: A wedding cake with a Bitcoin logo topper, and a plane ticket sticking out of the side.]",#cryptocard,2026-06-12 09:31
"Don't fall for ""Up to 10% cashback!"" marketing if it requires you to invite 50 friends and hold a worthless token. Always compare the baseline Tier 0 rewards. 🚩🤡 #cryptocard
What is the best flat-rate entry card?","[PROMPT: A clown holding a giant ""10%"" balloon that is full of holes and deflating rapidly.]",#cryptocard,2026-06-12 18:30
"If you’re not earning at least 1-2% on your daily spending in 2026, you are losing money to inflation. A basic #cryptocard is no longer a luxury, it's financial defense. 🛡️🛡️
What's your minimum acceptable cashback rate?","[PROMPT: A shield protecting a wallet from a dark storm cloud raining ""Inflation Drops"".]",#cryptocard,2026-06-13 09:07
"Brighty Card in the EU is quietly offering high yield on stablecoins directly tied to your daily spending card. Europeans finally have a defense against inflation. 🇪🇺🛡️ #cryptocard Check sweepbase.
What is the inflation rate in your country today?",[PROMPT: A European flag waving proudly over a vault completely stuffed with glowing digital euros and yield percentages.],#cryptocard,2026-06-13 17:56
"""I'm scared of smart contract risk."" That is a valid fear. If you want yield + a #cryptocard, stick to top 5 audited platforms or custodial giants with insurance funds. Don't risk your rent money on unproven protocols. 🛡️🛑
What's the safest platform in your opinion?","[PROMPT: A heavily reinforced digital bunker with multiple ""Audited by CertiK"" style stamps of approval.]",#cryptocard,2026-06-14 09:05
"Some cards even refund your foreign ATM withdrawal fees! When the local ATM charges you $6, the #cryptocard reimburses it in native tokens. Incredible. 💰 Check sweepbase for options!
Has an ATM ever swallowed your card?","[PROMPT: An ATM spitting out a ""Fee"" receipt, which disintegrates into green digital cashback particles.]",#cryptocard,2026-06-14 17:59
"Yield generating self-custody cards? Yes. You can hold Lido Staked ETH (stETH) in your wallet, earn the daily rebase yield, and the #cryptocard directly spends the underlying value. 💧🥩
Are you holding liquid staking tokens?",[PROMPT: A glowing Ethereum logo melting into liquid droplets that funnel directly onto an NFC payment terminal.],#cryptocard,2026-06-15 08:21
"Gnosis Pay vs MetaMask Card. The EU Web3 giants. Gnosis links straight to a Safe multi-sig. MetaMask pulls directly from Linea. The ultimate battle for decentralized spending. 🦊🏦 #cryptocard
Which L2 integration wins?",[PROMPT: A robotic fox (MetaMask) looking across a glowing bridge towards a digital fortress (Gnosis Safe).],#cryptocard,2026-06-15 17:38
"Bitpanda Card vs Nexo Card? Bitpanda lets you literally spend Tesla stock and Gold at Starbucks. Nexo lets you spend a credit line backed by your BTC. 📈 #cryptocard Only at sweepbase.
Stocks or collateralized loans?",[PROMPT: A coffee cup on a table next to a physical block of gold and a stock ticker screen.],#cryptocard,2026-06-16 09:23
"The Netflix/Spotify rebate is the best Web3 gimmick. You stake their token, they give you $15 a month in crypto to cover your subscriptions. Free music, free movies. 🎵📺 #cryptocard
Are you getting subscription rebates?",[PROMPT: A person watching Netflix on a TV while a crypto token printer hums in the background.],#cryptocard,2026-06-16 17:37
"Let's talk ATM limits. An international ATM will charge you $5. Your crypto card shouldn't charge you another 2% on top. Look for cards with at least $1000/mo free ATM limits. 🏧🌍 #cryptocard
Do you even withdraw physical cash anymore?",[PROMPT: A glowing holographic ATM dispensing foreign currency without any fee warnings.],#cryptocard,2026-06-17 08:39
"The Nexo dual mode is insane. Move your assets to the credit wallet, earn up to 16% on some tokens, borrow against them at 0%, and swipe the card. It's a financial fortress. 🏰🔥 #cryptocard
Are you utilizing collateralized borrowing yet?",[PROMPT: A heavily armored medieval fortress powered by glowing crypto algorithms.],#cryptocard,2026-06-17 18:45
