Text,Image URL,Tags,Posting Time
"Digital nomads in tax havens: A self-custody crypto card ensures you aren't needlessly routing money through high-tax jurisdictions just to pay rent. Keep it on-chain and local. 🌴📑 #cryptocard
Do you consider tax laws when choosing where to travel?","[PROMPT: A hammock on a tropical island with a laptop showing a ""0% Tax"" dashboard.]",#cryptocard,2026-06-18 08:21
"Direct IBAN integration: The holy grail. Cards like Gnosis Pay give you your own EU bank account number, merging Web3 directly into the legacy rails without banking interfaces. 🎯 #cryptocard
Do you need an IBAN with your crypto card?",[PROMPT: A bridge connecting a futuristic crypto city and a classic European banking district.],#cryptocard,2026-06-18 18:40
"Buying a coffee in Tokyo using Ethereum staked in Europe... and the merchant gets Yen instantly with zero markup. This is the financial future we were promised. ☕🇯🇵 #cryptocard
What was your coolest cross-border purchase?","[PROMPT: A cyber-samurai drinking coffee, paying via a glowing Ethereum terminal.]",#cryptocard,2026-06-19 08:44
"Virtual card limits. Some platforms let you spawn 5 virtual cards and assign different cashback categories to each, then link them all to Apple Pay. The ultimate optimization. 📱🍏 #cryptocard
Do you organize your cards by category?","[PROMPT: A phone screen showing 5 different colored virtual cards fanned out, each labeled ""Food"", ""Travel"", ""Gas"", etc.]",#cryptocard,2026-06-19 17:53
"The absolute best setup in 2026: Salary direct deposits into Fiat -> Auto-convert to USDC -> Deposit into a 6% Yield wallet -> Connected directly to your #cryptocard. Fully automated wealth building. ⚙️💵
Is your financial setup automated?","[PROMPT: A steampunk-style machine with gears labeled ""Salary"", ""Yield"", and ""Spending"" all turning in perfect synchrony.]",#cryptocard,2026-06-20 08:43
"Some cards let you boost your cashback category. Choose 5% on groceries one month, 5% on travel the next. Dynamic rewards tailored to how you actually live. 🎯🛒 #cryptocard
What category do you spend the most on?","[PROMPT: A spinning dial showing ""Groceries"", ""Gas"", ""Travel"", locking onto a golden ""5%"" slot.]",#cryptocard,2026-06-20 17:59
"Don't underestimate the power of instant notifications. When you swipe abroad, you see the exact USD/EUR equivalent of your crypto instantly on your screen. Total transparency. 📱🔍 #cryptocard
Do you compulsively check your spending app?","[PROMPT: A phone screen showing a push notification with exact exchange rates: ""Spent 500 THB. Deducted 14.2 USDC"".]",#cryptocard,2026-06-21 08:39
"Say goodbye to the ""Travel Notice"". You don't need to call a bank administrator in another timezone to beg them to unblock your card in Vietnam. Your keys, your rules. 🇻🇳🔓 #cryptocard
Ever had your card blocked trying to buy dinner?",[PROMPT: A broken chain link lying next to a shiny digital debit card.],#cryptocard,2026-06-21 17:42
"Getting 5% cashback on foreign hotel bookings simply by using top-tier crypto cards is free money. Book flights, earn crypto, fly again. The ultimate loop. ✈️🔄 #cryptocard
Where's your dream vacation?","[PROMPT: An infinity symbol made out of airplanes, luggage, and crypto symbols.]",#cryptocard,2026-06-22 09:04
"Imagine using the APY from your Bitcoin stack to pay off your monthly Netflix and Spotify. You retain your BTC, and the passive ecosystem pays your bills. 🧘‍♂️📺 #cryptocard Check sweepbase.
What bill do you want your yield to cover?","[PROMPT: A glowing Bitcoin levitating, shooting a small laser beam that vaporizes a physical Netflix bill.]",#cryptocard,2026-06-22 18:04
"Plutus Card vs Curve + Crypto? Plutus gives you perks without giving up your private keys to an exchange. Curve abstracts it all. Both are powerful tools for the UK/EU. 🇬🇧🇪🇺 #cryptocard
What's your daily driver?","[PROMPT: Two futuristic debit cards clashing like lightsabers, sparking digital crypto coins.]",#cryptocard,2026-06-23 08:43
"""I prefer my travel credit card for the miles."" Sure, but 2-5% instant crypto cashback usually mathematically beats points that devalue every year. 🧮✈️ #cryptocard
Do you track the value of your airline miles?","[PROMPT: A chart showing airline miles depreciating in value over time, while crypto cashback arrows point up.]",#cryptocard,2026-06-23 17:22
"Have you noticed some crypto cards say ""0% FX fee"" but their spread on selling Bitcoin to Fiat is 2%? 📉 Always fund with Stablecoins when traveling to bypass crypto spread entirely. #cryptocard
USDC or USDT abroad?","[PROMPT: A trap door labeled ""2% Spread"" with a user carefully stepping over it using a ""USDC"" stepping stone.]",#cryptocard,2026-06-24 09:13
"Tier systems make you stick to one exchange. If you are deeply embedded in Bybit or OKX, it mathematically makes sense to use their #cryptocard to compound your VIP status. 🔗🏛️
Are you loyal to one CEX or bounce around?",[PROMPT: A golden VIP crown sitting on top of an OKX and Bybit terminal.],#cryptocard,2026-06-24 18:19
"Apple Pay vs Google Pay integration. It sounds simple, but 30% of new crypto cards STILL don't have Apple Pay on day 1. Total dealbreaker for mobile nomads. 🍏 #cryptocard
Are you an iOS or Android spender?","[PROMPT: A standoff between the Apple logo and the Android logo, both holding virtual payment cards.]",#cryptocard,2026-06-25 08:22
"Yield generated on standard bank accounts is heavily taxed in many jurisdictions. Depending on your country, holding growth-focused yield tokens on a non-custodial #cryptocard might be much more efficient. ⚖️📑
Consult your local tax professional!",[PROMPT: An umbrella (growth tokens) shielding a user's savings from a heavy rainstorm of taxes.],#cryptocard,2026-06-25 17:27
"High Cashback vs High Privacy. You usually can't have both. 8% cashback requires KYC and holding custodial tokens. Total privacy (OffGrid Card) means slightly higher fees but anonymity. 🥷 #cryptocard
Which pill are you taking?","[PROMPT: Two pills Matrix-style. Red Pill: ""8% Cashback"". Blue Pill: ""Total Privacy"".]",#cryptocard,2026-06-26 08:18
"Maximize rewards by paying your rent/mortgage with a #cryptocard. Even at 1%, earning cashback on a $2,000 monthly expense is $240 a year for doing nothing. 🏠💰 Check sweepbase!
Can you pay rent with a card in your country?",[PROMPT: A house wrapped in a giant ribbon made of crypto logos and dollar signs.],#cryptocard,2026-06-26 17:18
"High yield usually means high risk. If a platform is offering 20% APY on stablecoins attached to a debit card, read the fine print. How are they generating it? DeFi lending or risky leverage? 🔍⚠️ #cryptocard
Always do your own research!","[PROMPT: A warning sign flashing neon red over a suspiciously large ""20% APY"" billboard.]",#cryptocard,2026-06-27 09:24
"Let's talk Stablecoins: USDT on TRC-20 vs USDC on Arbitrum. Which network do you prefer to fund your #cryptocard? 🚄
Tron is cheap, but L2s are catching up fast.","[PROMPT: Two race cars on a track. One green (USDT), one blue (USDC), drifting through a corner.]",#cryptocard,2026-06-27 18:33
"What happens if your native reward token goes 10x? Your 2% cashback from last year just effectively became 20% cashback. That’s the beauty of earning in Web3. 🚀📈 #cryptocard
Has your cashback ever pumped significantly?","[PROMPT: A small seedling labeled ""2% Payout"" instantly erupting into a giant glowing money tree.]",#cryptocard,2026-06-28 09:20
"Stop withdrawing $1000 at the airport just in case. Just tap to pay everywhere. A good #cryptocard covers you for 95% of your international trip directly. 🌍
Are you a raw cash carrier or tap-to-pay only?",[PROMPT: A thick wallet exploding with heavy foreign coins vs a minimalist phone wallet.],#cryptocard,2026-06-28 18:19
"Custodial (Binance) vs Non-custodial (1inch/Avici). Custodial is free and fast, but your keys are held. Non-custodial costs gas but you are sovereign. 🛡️ #cryptocard
Is convenience worth giving up your keys?",[PROMPT: A visually split image: Left is a bank vault door; Right is a glowing personal safe holding a smart contract.],#cryptocard,2026-06-29 09:19
"We are moving towards a future where your wallet address acts as your bank, your broker, your savings account, and your debit card. The #cryptocard in your pocket is just the key to the ecosystem. 🌐🔑
Are you prepared for the fully tokenized future?","[PROMPT: A glowing, glowing digital key unlocking a futuristic, utopian city that runs entirely on decentralized finance.]",#cryptocard,2026-06-29 17:29
"The real comparison: Your portfolio's value vs your bank's value. If 90% of your net worth is on-chain, why is 100% of your spending off-chain? Bridge the gap. 🌉 #cryptocard
Are you unbanked yet?","[PROMPT: A pie chart. ""Net Worth: On-chain"", ""Spending: Off-chain"". Next to it, an arrow showing them merging.

### 💱 FX Fees & Global Travel (126-150)]",#cryptocard,2026-06-30 09:29
"BipTap vs Extsy Card: The anonymous battle. Virtual, zero KYC, global acceptance. Just fund it and disappear into the digital ocean. 🥷💳 #cryptocard
Do you trust zero KYC providers?","[PROMPT: A dark cyber-alley with a neon sign reading ""No KYC"", and an anonymous figure walking through.]",#cryptocard,2026-06-30 17:59
"Using a virtual #cryptocard loaded onto Google Pay is the ultimate travel hack. You can literally create a new card per country and isolate your spending to avoid fraud. 🥷🌍
Have you had a card skimmed at an airport?","[PROMPT: A digital map of the world, with different colored virtual cards hovering over different continents.]",#cryptocard,2026-07-01 08:48
"The Bybit Card drops special 10% cashback promo days randomly. You buy a TV on Tuesday? 2%. You wait for the promo on Friday? 10%. Timing the market, but for your shopping. ⏱️📺 #cryptocard
Do you wait for promos to make big purchases?","[PROMPT: A calendar with a random Friday glowing aggressively in gold, labeled ""10% Promo Drop"".]",#cryptocard,2026-07-01 17:43
"Remember: If an exchange gets hacked while you’re abroad, custodial cards go down. Non-custodial cards tied to your Ledger keep working. Travel safe. 🛡️🎒 #cryptocard
Custodial or Non-custodial for traveling?","[PROMPT: A traveler wearing a backpack with a glowing forcefield (representing non-custodial security).

### 🤑 Maximizing Cashback & Tier Systems (151-175)]",#cryptocard,2026-07-02 08:31
"Centralized yield (Binance) vs DeFi yield (Ether.fi Cash). One yields via backend exchange liquidity, the other yields natively on Ethereum while you hold the card. 💧 #cryptocard Check sweepbase.
Trad-Crypto vs Pure DeFi?","[PROMPT: A skyscraper with a Binance logo vs a floating, decentralized island pumping out Ethereum yield.]",#cryptocard,2026-07-02 18:12
"Staking stablecoins on your #cryptocard platform is essentially acting as a market maker for their exchange. They use your liquidity, you get a massive cut of the fees. It's a symbiotic relationship. 🤝🏦
Do you understand where your yield comes from?","[PROMPT: Two hands shaking: One is a normal consumer, the other is a glowing holographic network representing exchange liquidity.]",#cryptocard,2026-07-03 09:05
"With the right #cryptocard, you are effectively running a micro-hedge fund out of your pocket. Yield farming on the backend, spending fiat on the frontend. Complete abstraction. 🧑‍💼📱
Do you feel like a fund manager in Web3?","[PROMPT: A person wearing casual clothes looking at their phone, but their shadow is cast as a high-powered Wall Street executive.]",#cryptocard,2026-07-03 17:34
"Best card for US residents? The options are shrinking but the survivors are getting stronger. Coinbase, Fold, and BitPay are holding down the fort. 🦅🇺🇸 #cryptocard Check sweepbase.
Why is the US so strict on card issuance?",[PROMPT: A bald eagle clutching a sleek metal crypto debit card in its talons.],#cryptocard,2026-07-04 08:46
"Don't leave your Binance Card or Crypto.сom Card empty. Even if you only keep a $500 balance, the internal APY usually destroys the inflation rate. Every dollar should be working. 💼💦 #cryptocard
Have you checked your idle balances lately?","[PROMPT: A drill sergeant yelling at a bunch of lazy, sleeping dollar bills to wake up and start working.]",#cryptocard,2026-07-04 17:15
"European heavyweights: Holyheld vs Brighty Card. Both target the EU market with sleek apps and fast SEPA integration. Brighty offers up to 7%+ yield on tied accounts. 🇪🇺💶 #cryptocard
Who is winning the EU?",[PROMPT: A map of Europe glowing with interconnected payment nodes.],#cryptocard,2026-07-05 08:28
"Why carry multiple currency wallets when a multi-chain #cryptocard automatically deducts the cheapest stablecoin you have? AI-level routing for your vacation. 🧠🛣️
Do you balance multiple stablecoins or just one?",[PROMPT: A glowing AI brain routing different digital coins efficiently through a network.],#cryptocard,2026-07-05 18:44
"Kolo Card vs Bit.Store Card for pure memecoin spending! Both accept massive numbers of niche tokens globally. Why sell PEPE when you can just tap your card? 🐸🔥 #cryptocard
Do you actually spend memecoins?","[PROMPT: Pepe and Doge high-fiving over a restaurant bill, with a glowing terminal between them.]",#cryptocard,2026-07-06 08:43
"Travel benefits: Fizen Card vs Bybit Card. Fizen gives you direct eSIM and hotel hotel discounts. Bybit gives you raw Priority Pass lounge access. 🏝️✈️ #cryptocard
Are you a nomad or just on vacation?","[PROMPT: A suitcase packed with a laptop, a Bybit card, a Fizen card, and a pair of sunglasses on a beach.]",#cryptocard,2026-07-06 17:30
"Fiat Bank Debit vs Web3 Crypto Debit. 
Bank: 0% cashback, 3% extra FX fee, funds locked randomly.
Web3: 5% cashback, 0% FX fee, self-sovereign. 🧠 #cryptocard
Why does anyone still use legacy debit?","[PROMPT: A dinosaur trying to use a traditional plastic bank card at an ATM, next to a cyborg tapping a smartphone.]",#cryptocard,2026-07-07 09:27
"Spend-to-Earn games? Nah. Spend-to-DCA is the real meta. Earning a fixed 2% back in Bitcoin perfectly smooths out market volatility while you buy groceries. 🛒📈 #cryptocard
What's your DCA strategy?",[PROMPT: A chart showing market volatility being smoothed into a straight upward DCA line by a shopping cart.],#cryptocard,2026-07-07 18:34
"Are you grinding for 8% cashback? Don't forget the math. Locking up $100k in exchange tokens for 8% is risky. Sometimes the 3% free tier mathematically wins in a bear market. 🧮📉 #cryptocard
Are you staked for high tiers?",[PROMPT: A complex math equation on a chalkboard converting staked token volatility vs cashback earned.],#cryptocard,2026-07-08 09:08
"If a TradFi bank offered 8% APY on a checking account, there would be lines around the block. Web3 cards offer this daily, and the masses still ignore it. We are so early. ⏳🚶‍♂️ #cryptocard
Why are normal people so afraid of stablecoin yield?","[PROMPT: A massive queue of people standing outside a dull grey bank, entirely ignoring a futuristic, glowing 8% APY crypto terminal right next to them.]",#cryptocard,2026-07-08 17:40
"If you are staking $10,000 to get a 5% cashback tier, calculate your break-even point. If you spend $2,000 a month, it takes months to regain the staking lockup risk. Do the math! 🧮📉 #cryptocard
Staking for tiers: Worth it or trap?","[PROMPT: A complex mathematical breakdown showing the exact timeline for returning a $10,000 staked investment via 5% cashback.]",#cryptocard,2026-07-09 09:03
"Warning: ""Earn up to 12% APY"" usually implies locking up funds for 3 months. Always check if the #cryptocard allows ""Flexible Yield"" so you can still spend your balance immediately! 🔓💳
Do you prefer locked high yield or flexible lower yield?","[PROMPT: A padlock glowing intensely red (Locked 12%) vs an open, flowing blue gateway (Flexible 5%).]",#cryptocard,2026-07-09 18:09
"Fractional reserve banking means banks lend out your money 10x over and give you nothing. Fully collateralized #cryptocard platforms keep 1:1 reserves and pay you the majority of the lending yield. Vote with your money. 🗳️🏦
Is traditional banking a scam? Let's hear it.","[PROMPT: A transparent, crystal-clear vault showing exactly 1:1 backed funds, contrasted with a shadowy, closed bank vault.]",#cryptocard,2026-07-10 08:28
"Don't let high foreign transaction fees wipe out your cashback! A 3% cashback means nothing if the card charges a 3% FX fee abroad. Net zero. Find cards that offer both! ⚖️✈️ #cryptocard
Are you tracking your net real rewards?",[PROMPT: An equation on a whiteboard: (3% Cashback) - (3% FX Fee) = Giant Red Zero.],#cryptocard,2026-07-10 17:16
"Paying for business expenses with a crypto card is the ultimate hack. Run $10k of server costs through an 8% #cryptocard and pocket $800 in personal crypto every month. 🏢💻
Do you run business expenses through your personal cards?",[PROMPT: A server rack emitting digital coins that funnel directly into a sleek metal business card.],#cryptocard,2026-07-11 08:38
"Remember that cashback is a volume game. Don't overspend just to earn 3% back. A good #cryptocard rewards your existing lifestyle, it doesn't encourage lifestyle inflation. 🧠🛑
Are you guilty of spending just to earn rewards?","[PROMPT: A monk sitting peacefully on a pile of cash, resisting the urge to buy a fancy car in the background.]",#cryptocard,2026-07-11 18:03
"The Crypto.сom Visa was the original flex, but is the staking tier still worth it in 2026? Compared to the Nexo Card that pays you yield on the collateral, the gap is closing. 🧐 #cryptocard
Are you a CRO holder?","[PROMPT: A rusty, majestic crown (Crypto.com) being challenged by a futuristic glowing wand (Nexo).]",#cryptocard,2026-07-12 08:29
"Earning 10% APY on USDC means a $10,000 balance generates $1,000 a year. Imagine your #cryptocard essentially paying for your phone bill and gym membership just for existing. passive income. 🏋️‍♂️📱
How much passive income are you aiming for?",[PROMPT: A glowing energy core (USDC) passively printing dollar bills into a smartphone and a gym bag.],#cryptocard,2026-07-12 17:57
"Be careful with ""cashback paid in native tokens"". If the card company goes bankrupt, your unredeemed rewards go to zero. Always withdraw your rewards from the card app to a cold wallet! 🥶🛡️ #cryptocard
How often do you sweep your rewards?",[PROMPT: A digital vacuum cleaner sucking digital coins out of a smartphone app and securing them inside a metal vault.],#cryptocard,2026-07-13 08:55
"CoinZoom Card actually pays you 3.99% APY on the idle funds sitting on your debit card. It’s a high-yield savings account that you can swipe at McDonald's. Unbelievable. 🍔💸 #cryptocard
Does your current debit card pay you interest?","[PROMPT: A sleek metal card resting on a plush pillow, calmly radiating floating interest percentage signs.]",#cryptocard,2026-07-13 17:48
"Combining merchant rewards: Some crypto cards offer their base 2% PLUS an extra 10% if you shop at specific stores like Nike or Starbucks. Stack your yield. ☕👟 #cryptocard
Are you a reward stacker?","[PROMPT: Stacking colorful blocks. Base Block: ""2% Visa"", Middle Block: ""10% Nike"", Top Block: ""Total Win"".]",#cryptocard,2026-07-14 09:23
"Coinbase Card (US) vs BitPay Card (US). Coinbase natively integrates with the ecosystem, but BitPay is the OG for straight Bitcoin spending. 🇺🇸🇺🇸 #cryptocard
What is your go-to US card?",[PROMPT: An American flag background with two sleek payment terminals facing each other.],#cryptocard,2026-07-14 17:32
"Earning 5% yield mathematically beats a 5% cashback over a long enough time horizon if you hold a high balance. If you have $50k, the yield destroys the cashback. 🧮💰 #cryptocard
High balance approach vs high spending approach: Which are you?","[PROMPT: A tortoise (Yield on high balance) racing a hare (Cashback on high spending), with the tortoise slowly winning.]",#cryptocard,2026-07-15 09:24
"Some platforms require you to convert to their native token to get the highest yield. Be careful! A 15% APY is useless if the token drops 20% in value. Sticking to Stablecoin yield is safer for card spenders. 🛡️📉 #cryptocard
Do you chase high APY or safe APY?","[PROMPT: A treacherous mountain climb. One path is super steep and crumbling (15% Altcoin yield), the other is a steady, paved ramp (6% Stablecoin yield).]",#cryptocard,2026-07-15 18:28
"The most underrated travel flex: Treating a local friend to dinner and explaining that the meal is effectively free because it was paid for entirely by your Ethereum staking yield. 🥩🍷 #cryptocard
Do you tell people you pay with crypto?","[PROMPT: Two friends toasting with wine glasses, a glowing Ethereum logo hovering over the paid bill.]",#cryptocard,2026-07-16 08:34
"Paying taxes with a #cryptocard. Yes, some countries allow tax payments via debit. Imagine earning 2% crypto cashback on your massive tax bill. The government literally pays you back. 🤯🏛️
Is paying taxes via card allowed where you live?",[PROMPT: A government tax building returning a handful of Bitcoin to a smiling taxpayer.],#cryptocard,2026-07-16 18:43
"Fold Card vs traditional airline rewards cards. Earning air miles is cool, but earning a spinning wheel that can literally pay out a whole Bitcoin? Unmatched alpha. 🎰 #cryptocard
Do you prefer fixed rewards or lottery mechanics?",[PROMPT: A traditional boring airline ticket vs a glowing Bitcoin roulette wheel.],#cryptocard,2026-07-17 08:46
"Did you know holding $EURT or $EURS stablecoins can also earn yield? You don’t have to take USD currency risk to get Web3 APY. Load your #cryptocard in Euros and earn natively. 🇪🇺💶
Do you prefer USD or EUR stablecoins?","[PROMPT: A glowing Euro symbol surrounded by a protective energy shield, deflecting dollar sign bullets.]",#cryptocard,2026-07-17 17:40
"The moment you land off a 12-hour flight, tap your phone to pay the taxi in local currency using your $SOL bags. No exchange booths, no getting ripped off. 🚕💨 #cryptocard Only at sweepbase.
What's the best airport in the world?","[PROMPT: A taxi driver holding up an NFC terminal, a traveler tapping it with a glowing Solana phone.]",#cryptocard,2026-07-18 08:45
"Metal Cards: Crypto.сom Obsidian vs KAST Gold. Both command respect natively. Obsidian requires massive staking, KAST requires stablecoin spending volume. ✨ #cryptocard Check sweepbase.
Does the weight of the card matter?","[PROMPT: Two insanely premium metal cards resting on velvet, reflecting neon lighting.]",#cryptocard,2026-07-18 17:20
