Text,Image URL,Tags,Posting Time
"There are cards you can load up purely with USDT using Tron (TRC-20) for $1 fees, and then spend in 200 countries within 5 minutes. That’s borderless money. 🚄🌍 #cryptocard
TRC-20 or ERC-20? Or is Solana taking over? 👇",https://sweepbase.net/tw/cashback_meme_1775669143222.png,#cryptocard,2026-04-10 08:42
"Global multi-currency support on a #cryptocard means you can hold USD, EUR, and GBP alongside BTC and USDC. Move between them to avoid inflation in your local currency. 💱
How bad is inflation in your country right now?",https://sweepbase.net/tw/card_slicing_bills_1775669159401.png,#cryptocard,2026-04-10 18:27
"🛡️ For the multi-chain power users: **OKX Card** offers spending with zero transaction fees and a tiny 0.4% conversion spread. Plus up to 4% instant USDC cashback. Pure efficiency. 🇪🇺 Check sweepbase. #cryptocard
What's the highest exchange fee you've ever paid by mistake?",https://sweepbase.net/tw/bank_vs_crypto_1775669176010.png,#cryptocard,2026-04-11 08:55
"Are you still paying for airport lounge access? Because plenty of premium #cryptocard options give you global Priority Pass access just for holding tier status. ✈️🥂
What’s your favorite airport lounge worldwide?",https://sweepbase.net/tw/airport_lounge_1775669835890.png,#cryptocard,2026-04-11 17:42
"Many people don't know this, but most #cryptocard rewards are tax-free in the US (treated as rebates, not income). Do your own research, but cashback is literally free money. 💰🇺🇸
How confusing are crypto taxes in your jurisdiction?",https://sweepbase.net/tw/tax_shield_1775669854487.png,#cryptocard,2026-04-12 09:38
"Trading memecoins is stressful. Cashing them out directly onto a #cryptocard and buying dinner with 1000x gains is therapeutic. 🧘‍♂️🍲
Have you ever taken profits directly to a Visa card?",https://sweepbase.net/tw/zen_monk_crypto_1775669872583.png,#cryptocard,2026-04-12 18:18
"Getting free Netflix, Spotify, and Amazon Prime just for holding your crypto. TradFi banks charge you monthly fees, Web3 cards pay your subscriptions. We are not the same. 📺🎵 #cryptocard
What's the best perk you've ever had on a card?",https://sweepbase.net/tw/card_slicing_streaming_1775669889014.png,#cryptocard,2026-04-13 09:05
"Wait, you're taking out a personal loan from a bank at 12% APR? 🤯 While you hold $ETH? Just use a crypto-backed #cryptocard credit line. Keep your assets, get instant fiat, pay 0-4% APR. 💸
Have you ever taken a DeFi loan?",https://sweepbase.net/tw/defi_vs_tradfi_loan_1775669905302.png,#cryptocard,2026-04-13 18:37
"""Not your keys, not your coins"" used to mean you couldn't spend them. Not anymore. 🤯 Real self-custody cards let you pay with Visa/Mastercard while keeping your funds on a Ledger or smart contract! #cryptocard
Are you a self-custody maxi or do you use CEX cards?",https://sweepbase.net/tw/ledger_mastercard_1775669921860.png,#cryptocard,2026-04-14 09:13
"The progression of a crypto investor: 
1. Buys on CEX. 
2. Moves to Hardware Wallet. 
3. Discovers DeFi. 
4. Links wallet to a #cryptocard. 
5. Never touches a traditional bank again. 🧬
What stage are you at right now? 👇",https://sweepbase.net/tw/crypto_evolution_1775669936132.png,#cryptocard,2026-04-14 17:33
"Do not overlook the FX markup! A good #cryptocard offers standard Visa/Mastercard rates globally. Poor ones sneak in a 2-3% invisible conversion fee. You could be losing hundreds. 💱🔍
Have you checked your card's conversion spread lately?",https://sweepbase.net/tw/magnifying_glass_terms_1775669949562.png,#cryptocard,2026-04-15 08:48
"Everyday purchases = Auto DCA. 🛒 If you get 2% back in Bitcoin on everything you buy, you are dollar-cost averaging without even thinking about it. #cryptocard
Are you actively DCAing right now?",https://sweepbase.net/tw/shopping_cart_1775670097568.png,#cryptocard,2026-04-15 17:32
"💡 TIP: Never use a #cryptocard that charges high spread on conversion. If they say ""0% fees"" but give you an exchange rate 3% below market, you're getting scammed. 📉 Always check the spread!
Have you been caught by hidden spread fees?",https://sweepbase.net/tw/hidden_spread_fees_1775670111103.png,#cryptocard,2026-04-16 08:46
"The ultimate portfolio hack isn't finding a 100x gem. It's optimizing your daily expenses. By routing your life through a high-cashback #cryptocard, you are earning a risk-free yield on your own existence. 💸
How much of your monthly budget goes through crypto?",https://sweepbase.net/tw/expenses_funnel_1775670126073.png,#cryptocard,2026-04-16 18:26
"Remember when we had to wait 3-5 business days for an international wire transfer? 🐌 Now you just send a stablecoin globally in 2 seconds and the recipient spends it instantly on their #cryptocard. 
Have wire transfers ever delayed a major purchase for you?",https://sweepbase.net/tw/snail_swift_1775670141889.png,#cryptocard,2026-04-17 09:23
"You haven't truly lived until you've bought a McDonald's hash brown using $PEPE coin. 🐸🍟 The magic of a #cryptocard turning memes into breakfast. Only at sweepbase.
What's the weirdest coin you've ever used to buy something?",https://sweepbase.net/tw/pepe_mcdonalds_1775670160600.png,#cryptocard,2026-04-17 17:48
"""Crypto is just internet play money, you can't buy real things with it!"" 
*Taps #cryptocard to buy a car* 🚗💨
What's your ultimate moon purchase?",https://sweepbase.net/tw/chad_sports_car_1775670172991.png,#cryptocard,2026-04-18 09:29
"💳 Need a card connected to liquidity, without losing the yield you earn on DeFi? **Ether.fi Cash Card** lets you borrow against your ETH/USDC without selling. Live on the edge. 🌊 #cryptocard
Would you use your staked ETH as collateral for groceries?","[PROMPT: An Ethereum logo surrounded by yield arrows, fueling a Visa Signature card.]",#cryptocard,2026-04-18 18:09
"""Crypto is too complicated for the average person."" 🗣️ 
No, it's not. If you know how to use a banking app and tap a debit card, you know how to use a modern #cryptocard. The tech is finally invisible. 👻
What's the hardest part about onboarding friends to crypto?",[PROMPT: A grandmother confidently tapping a shiny crypto card at a grocery store checkout.],#cryptocard,2026-04-19 09:29
"""Is this card accepted here?"" Yes. If they take Visa or Mastercard, your #cryptocard works. Merchats don't even know you're paying with Ethereum; they just receive fiat. Seamless. 🎭
Have you ever had to explain crypto to a cashier?",[PROMPT: A split perspective. What the user sees: Sending Ethereum. What the cashier sees: Receiving USD cash.],#cryptocard,2026-04-19 18:06
"Traditional banks hitting you with 3% foreign exchange fees on EVERY transaction abroad? That's robbery. 🛑 Get a #cryptocard with 0% FX fees and spend your stablecoins exactly at the market rate. 
Where is your next travel destination? 🏖️","[PROMPT: A thief wearing a ""3% Bank FX Fee"" mask running away with cash, while a ""0% Crypto FX"" superhero stops him.]",#cryptocard,2026-04-20 09:01
"A traditional bank can block your account on a Friday night, leaving you stranded. A self-custody #cryptocard relies on code, not a grumpy risk-management employee. 🤖
Code is law. Do you agree?","[PROMPT: A lock icon morphing into an open door, with blockchain nodes forming the bridge.]",#cryptocard,2026-04-20 17:43
"Converting fiat is painful. USD to EUR to JPY... just hold a global stablecoin, tap your #cryptocard, and let Visa/Mastercard handle the local conversion instantly. 🌎
Have you ever been scammed by an airport currency exchange?","[PROMPT: An airport currency exchange booth with a sign ""We Rip You Off"", completely empty, while a traveler confidently uses their phone to pay.]",#cryptocard,2026-04-21 08:32
"📈 Want your card balance to grow while it sits there? The **CoinZoom Card** offers up to 5% cashback AND pays you 3.99% APY on your idle card funds. Your money literally never sleeps. 💸 #cryptocard
What APY does your current bank offer?","[PROMPT: A CoinZoom card resting on a bed, while animated coins actively multiply around it.]",#cryptocard,2026-04-21 18:20
"🚀 Tired of giving up control of your crypto just to buy a coffee? With the **1inch Debit Card**, your funds stay on your self-custodial wallet until the second you pay. Plus, up to 2% cashback. 🌍 Check sweepbase! #cryptocard
Ready to go fully non-custodial? 👇","[PROMPT: Split infographic. Red background: ""Normal Cards"" (Funds locked). Green background: ""1inch Card"" (Full self-custody).]",#cryptocard,2026-04-22 09:18
"Bank: ""Why are you sending money to this exchange?!"" 😡
#cryptocard: ""Sir, would you like your 5% cashback in Solana or Ethereum today?"" 🎩✨
Why do traditional banks hate crypto so much?","[PROMPT: The ""Virgin TradFi Bank vs Chad Crypto Card"" meme format.]",#cryptocard,2026-04-22 17:26
"✈️ Free Spotify, Netflix, and VIP airport lounge access. And you don’t even need to stake tokens? The **Bybit Card** gives up to 10% cashback just based on your VIP level. Perfect for nomads. 💳 Check sweepbase! #cryptocard
Are you still paying for your subscriptions with fiat?",[PROMPT: A sleek Bybit card resting on a passport inside a luxury airport lounge.],#cryptocard,2026-04-23 08:21
"Imagine minting an NFT that acts as your actual Swiss bank account. It's not a drill. Some cutting-edge cards are doing exactly this. Mind blown. 🤯 #cryptocard Check sweepbase.
Is NFT identity the future of global banking?",[PROMPT: An NFT digital art piece that slowly transforms into an elegant Swiss debit card.],#cryptocard,2026-04-23 17:29
"🇪🇺 DeFi purists in Europe: **Gnosis Pay** is here. The first Visa connected directly to your Safe smart contract. Zero middlemen, up to 5% $GNO cashback, and direct IBAN integration. 🔐 Check sweepbase! #cryptocard
Can traditional banks compete with this?",[PROMPT: Architectural diagram: Gnosis Safe -> Padlock icon -> Visa Terminal.],#cryptocard,2026-04-24 08:34
"Booking flights and hotels with crypto used to mean waiting for slow, expensive third-party platforms. Now you just type in your #cryptocard number on booking.com and you're done. 🏨
What's the best travel hack you know?","[PROMPT: A beautiful hotel room with a view, and a crypto portfolio app overlaid on the window.]",#cryptocard,2026-04-24 18:35
"The feeling of seeing an instant push notification that you earned $5 in Solana just for buying a pizza. Unmatched. 🍕🔥 #cryptocard
Which blockchain has the fastest settlement for cards?","[PROMPT: A smartphone screen showing a push notification: ""Paid $25 at Joe's Pizza. Earned 0.05 SOL!"".]",#cryptocard,2026-04-25 08:35
"Buying coffee with crypto in 2013: 45 minute wait, 3 network confirmations, anxiety. 😰
Buying coffee with a #cryptocard in 2026: 0.5s tap, instant settlement. We made it, anon. ☕
Are we still early?","[PROMPT: A ""Doge"" looking exhausted in 2013 next to a complex mining rig, vs an ultra-cool ""Swole Doge"" effortlessly tapping a phone in 2026.]",#cryptocard,2026-04-25 18:42
"Don't want exposure to volatile crypto? No problem. Simply load your #cryptocard with $USDC or $USDT. 💵 It acts exactly like a USD bank account but with Web3 perks.
Do you spend stables or volatile assets?",[PROMPT: A shield protecting a stablecoin from a barrage of red and green arrows (market volatility).],#cryptocard,2026-04-26 09:09
"Stablecoin spending tip: Always use low-gas networks. Topping up a card using ERC-20 will cost you $15 in gas. Using Polygon, Solana, or Arbitrum costs pennies. Route efficiently! 🛤️🪙 #cryptocard
What's your go-to network for sending stablecoins?",[PROMPT: A race track showing Ethereum moving like a slow turtle vs Solana/Arbitrum zooming by like supercars.],#cryptocard,2026-04-26 18:31
"The ultimate crypto test: Try paying for your morning commute using your portfolio. A few years ago it was impossible. Today, it takes a single Apple Pay tap with a #cryptocard. 🚇✅
Have you integrated crypto into your 9-to-5 life yet?","[PROMPT: A glowing crypto terminal on a subway turnstile, flashing a green ""Access Granted"".]",#cryptocard,2026-04-27 08:23
"The ultimate travel flex: Paying for a first-class upgrade using the yield generated from your stablecoin staking on your #cryptocard. Your money literally bought the ticket. 🎫💼
Economy, Business, or First Class?","[PROMPT: A sleek airplane seat with a champagne glass, and a push notification: ""Paid with Staking Yield"".

### 🎭 Web3 Culture & Memes (46-55)]",#cryptocard,2026-04-27 18:04
"⚡ **Bitrefill Card** is built for the Bitcoiners. Load up via the Lightning Network instantly and spend in Euros across the EEA with a transparent fee structure. No nonsense. 💶 #cryptocard
How often do you use the Lightning network?","[PROMPT: A yellow lightning bolt striking a digital terminal, instantly converting into Euro coins.]",#cryptocard,2026-04-28 09:03
"Remember when we thought Bitcoin ATMs were the future? 😂 Now you just load an app, tap a virtual #cryptocard, and your grocery store is the ATM. Evolution!
Have you ever actually used a Bitcoin ATM?","[PROMPT: An old, rusty Bitcoin ATM covered in vines, next to a futuristic smartphone projecting a hologram of a crypto card.]",#cryptocard,2026-04-28 18:31
"🔥 8% cashback + 6% APY on your card balance. It’s hard to beat the **COCA Card**. Zero FX fees and MPC security means you keep your yield and spend freely across 14 blockchains. 🚀 Only at sweepbase! #cryptocard
Stables or volatile assets for daily spending?","[PROMPT: 3D Pie chart showing ""6% Yield"" and ""8% Cashback"" with the COCA brand colors.]",#cryptocard,2026-04-29 09:14
"Buying the dip is great, but spending the peak is better. Secure your profits on-chain, move to an instant #cryptocard, and treat yourself. You earned it. 🥩🍷
What was your best crypto purchase ever?",[PROMPT: A fancy steak dinner on a table with a smartphone displaying a green +300% PNL chart.],#cryptocard,2026-04-29 18:22
"Some crypto cards give you up to 7% cashback specifically on hotel bookings and travel expenses. Your bank gives you a branded pen. 🖊️😭 #cryptocard
Are travel points better than raw crypto cashback?","[PROMPT: A sad person looking at a cheap bank-branded pen, contrasted with a happy traveler receiving 7% cashback notifications.]",#cryptocard,2026-04-30 08:47
"Smart contracts are the new checking accounts. Set up a daily spending limit on-chain, attach a virtual #cryptocard, and let the code handle your security. 🔒
Would you trust a smart contract with your monthly budget?",[PROMPT: Code snippets floating holographically around a physical debit card.],#cryptocard,2026-04-30 18:25
"ATM withdrawals used to be the final boss of traveling. With zero-fee international #cryptocard withdrawals, pulling cash locally is finally stress-free. 🏦💸
Do you still carry physical cash when you travel?",[PROMPT: A glowing crypto ATM dispensing local currency with zero fees highlighted in green.],#cryptocard,2026-05-01 08:16
"Earning your salary in crypto is cool until you need to pay rent. The easiest off-ramp? A dedicated #cryptocard equipped with a personal IBAN. Crypto to SEPA in seconds. 🇪🇺
Do you get paid in crypto or fiat?",[PROMPT: A visual pipeline pumping digital tokens into a machine that spits out Euros directly into a landlord's hands.],#cryptocard,2026-05-01 18:42
"No KYC, no problem. Yes, there are virtual #cryptocard options you can set up in 60 seconds with zero identity verification. Load via stablecoins, add to Google Pay, and stay invisible. 🥷 
Do you value privacy over cashback?","[PROMPT: A hacker/cyberpunk-style neon interface showing a virtual card being generated with a ""KYC: Bypassed"" green checkmark.]",#cryptocard,2026-05-02 08:29
"Stop using your bank debit card online. 🛑 If it gets compromised, your entire checking account is gone. Use a prepaid #cryptocard, load only what you need, and isolate your risk. Cybersecurity 101. 🔐
Have you ever had your bank card stolen or cloned?","[PROMPT: A fortress wall protecting a life savings vault, with a tiny, isolated payment bucket outside the wall.]",#cryptocard,2026-05-02 18:42
"Is Apple/Google Pay integration necessary for a #cryptocard? Absolutely. Without it, you are carrying around physical plastic like it's 2010. Demand mobile wallet integration in 2026. 🍏📱
Do you even carry a physical wallet anymore?","[PROMPT: A gravestone with the words ""Physical Leather Wallet 1950 - 2024"".]",#cryptocard,2026-05-03 09:23
"Telegram-native crypto cards are taking over. 📲 Launch a bot, verify instantly, get a virtual #cryptocard, and start spending without ever downloading a new app. The friction is completely gone.
Would you trust a Telegram bot with your banking?",[PROMPT: A futuristic Telegram chat bubble containing a fully interactive Mastercard inside it.],#cryptocard,2026-05-03 17:49
"Getting 10% cashback sounds fake until you realize it's just marketing budget given directly to the users instead of TV ad agencies. Web3 economy wins again. 🤑 #cryptocard
What's the highest cashback you've ever hit?","[PROMPT: A TV with a crossed-out ""Bank Ad"" on the screen, and a person holding a shiny card getting a rain of digital coins.]",#cryptocard,2026-05-04 09:37
"The real metaverse is being able to take your digital wealth anywhere on earth and use it to buy physical experiences. 🏖️🍸 A #cryptocard is the bridge.
Virtual world or physical world: Where do you spend more?",[PROMPT: A VR headset emitting a glowing path that leads to a luxurious real-world beach resort.],#cryptocard,2026-05-04 17:58
"🏝️ If you live out of a suitcase, the **Fizen Card** was built for you. Zero conversion fees on stablecoins and embedded travel discounts for hotels and eSIMs. The digital nomad dream card. 🥥 Check sweepbase. #cryptocard
Where is your favorite place to work remotely?","[PROMPT: A laptop and a cocktail on a tropical beach desk, with a Fizen card booking a discounted flight on the screen.]",#cryptocard,2026-05-05 08:29
"When your friends are arguing about which credit card has the best frequent flyer miles, and you're quietly stacking 8% back in raw $BTC on every transaction. 🤫🔥 #cryptocard
Do you tell your friends about crypto cards or keep the alpha to yourself?","[PROMPT: The ""They don't know"" meme party guy standing in the corner (""They don't know I'm getting 8% cashback in BTC"").]",#cryptocard,2026-05-05 17:52
"The ultimate life hack: Stake your crypto, earn 10%+ APY on the balance, AND spend it using a #cryptocard whenever you want. You literally become your own bank. 🏦 Check sweepbase for the best yielding cards!
Have you tried a yield-bearing debit card yet?","[PROMPT: Infographic showing ""Traditional Bank: 0.1% interest"" vs ""Crypto Card: 10% APY + Spending Power"".]",#cryptocard,2026-05-06 09:10
"Plot twist: The real flippening isn't ETH overtaking BTC. It's #cryptocard usage overtaking traditional banking apps. 📲💳 Check sweepbase to see the data.
Will physical cash exist in 2030? Let’s debate. 👇","[PROMPT: A dramatic chart showing Crypto Card adoption rocketing upward, crossing the declining line of traditional banking.]",#cryptocard,2026-05-06 17:35
"Fed up with big banks asking for a 10-page essay just to explain where your money came from? 🙄 A good #cryptocard respects your privacy and fast-tracks the BS. Your funds, your rules. Check sweepbase for private-centric cards.
Have you ever been interrogated by your bank?","[PROMPT: A frustrated person looking at a giant stack of banking paperwork, while a colorful crypto card shines through a cracked window behind them.]",#cryptocard,2026-05-07 09:13
"Bali, Dubai, Lisbon... The unofficial hubs for Web3 nomads. If you live here, you know a #cryptocard isn't just a novelty, it's a daily necessity for surviving the fiat system. 💻🍍 Check sweepbase to compare top picks.
Which city is the true crypto capital of the world?","[PROMPT: A futuristic cyberpunk skyline blending elements of Dubai, Bali, and Lisbon.]",#cryptocard,2026-05-07 17:15
"Wait, so how does it actually work? 🤨 1) You hold crypto in a wallet. 2) You swipe a #cryptocard at a store. 3) The provider instantly sells the exact amount of crypto for fiat behind the scenes. 4) The merchant gets fiat. It’s seamless. 🌉 Check sweepbase for a full breakdown.
Did you know merchants never actually touch your crypto?","[PROMPT: A clear, minimalist flow diagram: Crypto Wallet -> Lightning fast conversion bubble -> Merchant Cash Register.]",#cryptocard,2026-05-08 08:48
"We are finally entering the era of Multi-Chain Smart Cards. 🧠 A modern #cryptocard can pull USDC from Solana, ETH from Arbitrum, and BTC from your Ledger, all in one swipe. Interoperability is beautiful.
Are you loyal to one chain or a multi-chain maxi?",[PROMPT: A web of glowing colored lines (representing different blockchains) all converging perfectly into a single Visa chip.],#cryptocard,2026-05-08 18:19
"Connect your MetaMask directly to Apple Pay. Sounds like science fiction, but it's happening right now natively on Linea and other chains. 🦊💳 #cryptocard 
Have you used a wallet-connected card yet?","[PROMPT: The iconic MetaMask fox wearing sunglasses, holding a glowing smartphone with an Apple Pay wallet open.]",#cryptocard,2026-05-09 08:37
"Are you a high-volume spender? Watch the ATM limits. Some crypto cards cap you at $200 a month before charging 2% fees, while others let you withdraw $10k+ daily. Know your tier! 🏦🏧 #cryptocard
How often do you withdraw physical cash?","[PROMPT: A warning sign inside an ATM interface showing a ""2% Fee Applied!"" notification.]",#cryptocard,2026-05-09 18:19
"The beauty of Web3 banking: You can create unlimited virtual cards, use them once online, and burn them instantly. Perfect for sketchy subscriptions or free trials. 🗑️🔥 #cryptocard
Have you ever forgotten to cancel a free trial? We all have...",[PROMPT: A virtual card catching fire and dissolving into digital pixels.],#cryptocard,2026-05-10 08:28
"Don't sell your Bitcoin. Borrow against it. 🧠 Some new credit cards let you use your $BTC as collateral without ever selling a single satoshi. No capital gains tax events, just pure spending power. #cryptocard
Would you take a crypto-backed line of credit? Let's hear it!",[PROMPT: A golden Bitcoin logo shining inside a vault with a credit card floating above it.],#cryptocard,2026-05-10 18:35
"Stablecoin maxis, this one is for you. Earning 6% on your USDC while actively spending it at the grocery store is the peak Web3 experience. 🛒🔥 #cryptocard Only at sweepbase you can find the best stablecoin cards.
USDT or USDC? Pick your fighter! 👇",[PROMPT: A glowing USDC coin morphing into a Visa card mid-air.],#cryptocard,2026-05-11 08:53
"Using a #cryptocard isn't just about rewards; it's a protest against a slow, outdated, and exclusionary financial system. You are voting with your transactions. ✊🌍
What is your biggest complaint about the current banking system?","[PROMPT: A crowd of people holding up decentralized finance logos like protest signs in front of a giant, grey central bank.]",#cryptocard,2026-05-11 18:36
"🌐 Imagine a Visa Signature card that never touches your private keys. **Avici Card** supports 40+ tokens across 8 networks. Pay anywhere, auto-convert via DEX. No banking fees. 🛡️ #cryptocard
Big cashback or full self-custody: What do you prefer?","[PROMPT: Black metal Avici card surrounded by glowing neon logos of Solana, Base, and Arbitrum.]",#cryptocard,2026-05-12 09:19
"Centralized exchanges going down won't freeze your lunch money anymore. The rise of self-custodial debit cards means the collapse of a CEX has zero impact on your purchasing power. 🛡️ #cryptocard
Did you lose access to funds during the FTX crash? Let's talk about it. 👇","[PROMPT: A crumbling centralized exchange building in the background, while a person calmly taps a self-custody debit card on a coffee shop terminal in the foreground.]",#cryptocard,2026-05-12 18:32
"A lot of people ask ""Is it centralized if I use a Visa network?"" 🧐 Yes, the final settlement is. But holding custody until the exact millisecond of purchase is a massive leap forward. Progress over perfection. #cryptocard
Are you okay with compromising slightly on decentralization for convenience?","[PROMPT: A spectrum arrow. Extreme left: ""Buried Gold"". Right: ""Bank Account"". Middle: ""Self-Custody Crypto Card"".


### ⭐ Specific Card Highlights (81-100) (Affiliate Highlights)

*(Use these sparingly and rotate them so you don't sound like a shill!)*]",#cryptocard,2026-05-13 08:40
"No more calling your bank to say ""Hey, I'm going to Mexico, please don't block my card."" A decentralized #cryptocard natively belongs to the world. 🌎🌍🌏
Ever been stranded without a working card?","[PROMPT: A person making an angry phone call to a bank, while another person relaxes in a hammock using Apple Pay.]",#cryptocard,2026-05-13 17:34
"🦊 **MetaMask Card** is live for pilot users. Imagine swiping a Mastercard that pulls directly from your Linea wallet. 3% cashback on the Metal tier and zero foreign transaction fees. 💳 #cryptocard
Are you actively using the Linea network yet?",[PROMPT: The MetaMask Fox wearing sunglasses and holding a sleek metal Mastercard.],#cryptocard,2026-05-14 09:02
"Want to spend your crypto without triggering massive capital gains tax events? Look into crypto-backed credit lines. Deposit crypto, spend fiat. #cryptocard 💡 Only at sweepbase can you find the best comparisons.
How do you manage taxes on crypto spending in your country?","[PROMPT: A balancing scale. Left: ""Tax Event (Selling)"". Right: ""0% Tax (Borrowing)"", with the scale tipped heavily toward borrowing.]",#cryptocard,2026-05-14 17:35
